0.933663309,0年がかりでの商品化は気合いが入ってますね食堂ミサの味噌ラーメンが原点の味ということで私もミサの味噌ラーメンは大好きなので味には期待できます早く食べてみたい
0.933610201,まあ味の好みとかって人それぞれだけどさこれを食べてあおるやつの気持ちがわからないんよねただただ妬みでしょって思ってしまう
0.933343172,とてつもないプレッシャーの中で時間と労力を割いて商品開発している姿が容易に想像出来ます一週間休むのも納得です応援してます
0.933330655,この機会で思ったけどヒカキンさんが存在してないどyoutubeがつまらなくなったヒカキンさんが活動休止してから少し寂しく感じた事があった私はヒカキンさんを0年前くらいからしか見てないけど本当にいい人なのは分かる誰よりも長生きして欲しいヒカキンさんにどれだけ救われたか本当にありがとうございます
0.933329761,まっすぐで真剣で真摯でやっぱりヒカキン大好きヒカキンの夢が叶って嬉しいラーメンもカップメシも食べるの楽しみ
0.933045924,夢を叶えられた事おめでとうございます素晴らしい発売したら絶対買いに行っちゃいますスバラシイ
0.933017373,何にでも真摯な姿勢を崩さないんですよねそういう所が大好きです家族の分も買ってみんなで食べたいです
0.932955503,感動するなぁヒカキンさんの夢が叶ったの本当に嬉しいなおめでとうございます
0.932923555,濃厚味噌ラーメンが税込で0円なのなぜかひかきんの優しさ詰まってるような感じがしてすき
0.93291688,実際口に合う合わないは絶対あると思うけどここまで頑張った過程を考えるとそんなの関係なく食べたいって思う
0.932861924,お金持ち始める献呈的な人調子にのりすぎだわでも売れるといいですね
0.932797372,増産お願いしますまだ食べられてないです味の好みは人によって違うのでネットでまずいとか言ってるのは気にしないでいろいろ作ってほしい食べられる日を楽しみにしています
0.932775915,﻿店舗を作るんじゃなくてそれなりに誰でも手に入れられる商品を作ってくれるところに言葉に上手く出来ない優しさを感じる
0.932747841,内容ちゃんと見る前はラーメンとカップめしならラーメンがいいかなって思ってたけどこのカップめしめちゃくちゃ美味しそうやな発売日に買いに行こう笑
0.932691872,夢が叶ってすごく良かったですね私たちも夢を諦めずに頑張りたいと思います
0.932594121,完成おめでとうございます発売楽しみですラーメンは豚骨とかが人気が多いですがそこを味噌でくるところがたまらないしかもニンニクいり最高楽しみにしてますあちこちのセブン巡りしよ
0.932549119,おめでとうございますヒカキンさんの熱い想いがめちゃくちゃ伝わってきて感動しましたセブンさんに並ぶのを楽しみにしています
0.93249923,大好きなものを磨いていくその姿大人の私も勇気づけられるかっこいい
0.932354808,自分が叶えたい夢を叶えられて本当にすごいと思う自分も見習っていきますそしてどんな報告でも受け入れていきます
0.932345688,ヒカキンこそ努力に努力を重ねたtheyoutuberって感じまじですげぇ
0.93221885,ヒカキンって報われるまで努力できるの凄いな
0.932203293,0日まで待ちきれない私もラーメン大好きです本当にすごい行動力だよhikakinさんおめでとう
0.932165086,小さい子はにんにくは刺激的に感じるかもとかそういう配慮ができるのがすごいと思う
0.932058811,ラーメンの無い世界なんて考えられないほんとにラーメンって多くの人を救ってると思う
0.932054162,これ見て泣いた人いない説明すると長いけどすご心打たれた
0.932035625,hikakinさんが作ったラーメンなんだから絶対美味いに決まってる絶対に買います
0.931911469,味噌だからって安直にコーン放り込んでないヒカキン信用できる食べたい
0.93191123,一年賭けたラーメン食べますね近くで買えるの嬉しい
0.931816936,hikakinさんが幸せなことならこっちも嬉しい気分になれる
0.93174094,正直ここが僕一番見ていただきたいんですけどっておっしゃってますが自分の好きな人の夢が叶う過程を見せていただけるなんて光栄でしかないから見るに決まってますラーメン見かけたら絶対買います楽しみにしてますね
0.931727052,待ってこれにこの感想は失礼だと思うけど字うますぎる
0.931618273,ラーメンばばあのときを思い出す本当にラーメンが好きというのが伝わります
0.931597769,hikakinさん忙しい中でも本当に好きなことして生きてる感じがしてすごくいい
0.931583226,是非食べてみたいですhikakinさんがラーメン好きとは嬉しい
0.93152374,0年間やってて初めての休みきっといいご報告だと思うまじ楽しみ
0.931488514,hikakinさんは神なんなら仏の域にまで達してるただ普通に頑張っただけじゃあんまり夢って叶えられる物じゃないと思うからhikakinさんはものすごい努力の上にこの夢を実現してるんだと思う
0.931416154,このコメント残念だわまずそうとか言ってる奴は絶対買うなよヒカキンさんの努力の何も知らない奴が語ってんじゃねーよ
0.931203961,先日本当に生きているのが辛くなったんですが今日hikakinさんの夢が叶った姿を拝見して凄く元気をもらいましたいつも視聴者を気づかってくださる姿努力し続ける姿尊敬していますどうぞこれからも無理はなさらず楽しさを追い求めて活動してくださいいつもありがとうございます
0.931194961,夢が埋まってる鉱山をみんな掘っててでもいつ発掘できるかわかんないから途中で諦めたり投げ出したりするけど踏ん張った先には自分自身を支えてくれた夢に辿り着けるって思えましたhikakinさん夢実現おめでとうございます
0.930977881,自分も夢に向かって突き進んでさらに実現させるような人になりたいな
0.930934906,初コメどのyoutuberが食レポしてくれるんだろう忖度なしで私的にはサッポロ0番味噌ラーメンを越えるかどうか
0.930874944,お店に行かなきゃ食べれないとかじゃなくてコンビニで買えるっていうのに優しさ感じる
0.930775285,本当に楽しみにしてますカートンで買いたいです
0.93071717,泣けましたおめでとうございます0日セブン出勤なので必ず買わせていただきます出勤前に売り切れちゃいそう楽しみです
0.930715442,hikakinさん醤油味も作ってくださいお願いします
0.930698574,ヒカキンさん早く食べたいヒカキンさんの人柄が皆さんが携わってれるんでしょうね
0.930671632,0年間大好きなものに熱中して本気でできるの本当に尊敬
0.930663288,監修って名前だけ貸して開発とかはほぼ任せっきりな人もいる中こんな0から0まで全部本気で本人が携わってるのすごいな
0.930636227,ヒカキンさんおめでとうございますラーメンへの熱い想いが伝わってきました本当に美味しそうで今すぐ食べたいです追記沢山のグッドボタンや返信本当にありがとうございます
0.930633068,今日招き猫キン当たったのでhikakinさんが言ったみたいに大事に取っています
0.930600405,そんなにラーメン好きで救われる人がいるんですね私もラーメン屋さんで働いてるけどもっとラーメン屋さんで働いてる事に自信をもって働こうと思います
0.930599988,夢の実現おめでとうございます伝えたいことが箇条書きなのがわかりやすく誠実でラーメン屋っぽくもある
0.930594206,hikakinの凄い所はラーメンとカップ飯を両方しっかり食べてるところ
0.930520654,誰でも手に取れる価格帯ってのもありがたい必ず買って食べますそしてみんなのコンビニ紹介気になりますね
0.93050307,しょうもなって言ってる奴お前らが高く見すぎただけやろ本当にhikakinさんおめでとう
0.930482984,同い年で一番尊敬と安心感がある人柄ですラーメン発売おめでとうございます当日買いに行きます
0.93047297,発売おめでとうございます早速購入させていただきましたところ息子が当たりマークを出しました大きなご利益がありそうです
0.930472016,ミサは小さい頃行ってたな玉ねぎ甘めで味噌と合う懐かしい
0.930351198,食べてみましたすごい好きな味でしたー個人的にはお湯入れてから0分くらい待つのが麺がちょうどいい感じの太さになって好きでした
0.930348456,個人の感想なんですがめっちゃ美味しかったですメシの方はまだ食べれてないので再販したら絶対食べますこれからも頑張ってください
0.930321157,さっきコンビニ行ったら発売前なのに売ってたから四個ずつ買ってきた食べるの楽しみ
0.930296361,大好きなラーメン旅企画が商品開発の伏線だったの嬉しすぎ
0.930178344,こんなに楽しみな発表なかなかないから嬉しい絶対食べますこの勢いでラーメン屋さんも作ってください
0.930162907,ラーメンだけしか買えなかったけど優しい味で美味かったです
0.930155873,何事にも本気でどんな時も頑張ってきたからできたことだと思う本当に心から尊敬します
0.930113256,最近のヒカキンあるあるかもしれないけど後付けの夢っぽくてなんかねって感じここまでやる熱量とかは尊敬してます
0.929902852,疲れてるからとかじゃなくて報告準備に集中するために休むといういつも視聴者思いのヒカキンさんならどんな報告でも応援できます
0.929901898,早速それぞれ0つずつ買いました人気すぎて売り切ればかりで何店舗も周りました笑
0.929893076,ラーメン大好きなhikakinさんが作ったラーメンとか絶対に美味いやんあと手軽に買えるとか最高買うしかないわ
0.92986232,パッケージのデザインもセンスあって素敵ですね下積み時代も人生が変わるその日もラーメンと共に感動的です
0.929770529,0円本当にいつでも誰でも食べたいときに食べられる価格設定で泣ける
0.929753006,今日香川県観音寺市のセブンイレブンに買いに行ったら入荷待ちと言われました何時入荷するか分からないと言われました楽しみにしてたのにまた買いに行きますね
0.929751933,小麦アレルギーだからご飯あるの嬉しいお母さんにラーメン食べてもらおうヒカチャンよかったね
0.929678559,下積み時代ほんとうにしんどそうなのにここまで頑張って夢叶えてて尊敬します
0.929626107,視聴者の意見どうこうじゃなくてちゃんと自分の好きなこと貫いて努力してるのかっこよすぎる
0.929514229,夢実現おめでとうございます味噌ラーメン大好きなんです絶対食べます
0.929380417,本当にhikakinさんは聖人だなたとえ0週間休んだとしても視聴者の事を考えていて本当に尊敬するわ
0.929356635,再販の時に食べましたとても美味しかったです
0.929303408,一年間夢を叶えるために頑張ってたヒカキンさん凄いし尊敬した
0.929251969,もう涙が止まりませんヒカキンさんの一生懸命努力出来るところとか本当に尊敬します絶対に買います
0.929140866,ヒカキンー今日買って食べたよメシすごく美味しかったまた買います
0.929123998,食べてみましたスープがマジで美味え
0.929114699,今日誕生日だったからなんか嬉しいです❁❁hikakinさんおめでとうございますそしていつもお疲れ様です❁❁最初は売れすぎて中買えないと思いますが買える機会があれば買わせていただきますこれからもご無理なさらずに頑張ってください
0.929071486,買いましたすごく美味しかったですラーメン屋のラーメンより美味しかったです≧≦ありがとうございますたくさん食べます
0.928767085,hikakinさんの一生懸命作ったラーメン食べてみたい
0.928753197,発表するまで0分もかからないの流石ヒカキンって感じして好き
0.928737521,コンビニで売ってくれるのはありがたい味噌ラーメン普段食べんけどhikakinさんのラーメン食べてみたいと思いましたこれからもずっと応援しますがんばってください
0.928706884,目標を達成するために必死に頑張る人って応援したくなるよな
0.928703785,商品紹介を主にやってたyoutuberがこうして今自分の商品を紹介してるのほんと感慨深い
0.928703785,商品紹介を主にやってたyoutuberがこうして今自分の商品を紹介してるのほんと感慨深い
0.92868495,これからこちらの新商品のpop作りをさせていただきますセブンイレブン社員です売り切れそうわたしも食べます
0.928668857,好きなことで生きていくを実現させた漢かっこよすぎる
0.928649664,ラーメンに凄くこだわって作られたのが伝わってきます発売日楽しみです
0.928590059,hikakinpremium立ち上げおめでとうございますヒカキンさんの夢が叶ったこだわりのラーメン楽しみです
0.92856431,g明けに発売してくれるから連休明けのショックを和らげてくれているね
0.928491473,両方とも食べました美味しかったです
0.928467333,完売で買えませんでした孫が楽しみにしてました再発売お願いします
0.928436518,味噌ラーメン好きとしてとても気になる絶対買う味噌派閥にも嗜好が違う事があるからhikakinさんがどんな味が好きなのか楽しみ
0.928341329,味噌ラーメン味のカップ飯は売ってないからめちゃくちゃ嬉しいです絶対買います
0.928210914,初コメです八甲田山かよ今日日乾き物の味付けがどうかしたのかよ古い映画でもみたのかヒカキン
0.9280954,ラーメンの中では味噌が0番好きだから地元でも売られるようになったら絶対買う
0.928094923,服とかじゃ無くてラーメンなのほんとに好き流石hikakin
0.928040743,なんかヒカキンさんって自分の節目とかにいつも誰かの為にやる事ばかりでyoutubeを始めた頃から芯とか根本が全く変わらないんだろうなと泣きたくなる
0.927989602,おめでとうございますセブンでかえるの有り難い元気がない時に私もヒカキンラーメンでパワーもらいます✾
0.927962661,買いに行くね美味しそうもし叶うならヒカキンさんが着ているtシャツプレゼントキャンペーンしてくれますか
0.927861273,これはこれは努力の結晶でしかないですねぜひ見かけた際は食べて見ます
0.927809894,ちゃんと全国のラーメンを回るという伏線をはっていたと思うと鳥肌もんだわ
0.927772999,hikakinさん0週間を準備に費やしたならあともう一週間休んでから再開すればよかったのにマメな人だなぁ買ってみたい
0.927752018,絶対買いに行きます楽しみにしています
0.927726209,色んな人が先走った噂を流してて嫌だったけど0月0日が楽しみでも抗がん剤治療中で退院まだだから退院したらすぐ買いに行く
0.927712381,ヒカキーンおめでとうこれからも応援してるラーメン買えなかったけど次hikakinプレミアムの商品は絶対買ってやるー頑張ってください
0.927696466,ほんとに努力の積み重ねが遂に実った感じが伝わります
0.927685201,凄く思いの詰まったラーメンに仕上がったと思いますセブンが無くて買いに行けないのが残念ですが出かけた際に買いたいと思います
0.927671611,hikakinさんのお陰で夢って叶うんだなーって本気で思った何かが好きなだけでこんなに頑張れるんだねまじで勇気というか希望というか貰った気がするやっぱりyoutuberの中で0番尊敬してるし0番大好きだなー‪••
0.927620411,ラーメン苦手だけどその中で0番好きな味がミソだから嬉しい絶対食べる
0.927567542,ラーメンの味で味噌が0番好きだからめっちゃ嬉しいしかも安い買うしかないなヒカキンさんありがとうそしておめでとう
0.927507579,生姜感が強いと感じたのは気のせいですか••
0.927486837,本当に努力の塊でしかないhikakinさんが頂点で本当によかったぁ
0.927473426,ラーメンを初めて作った人ラーメンを広めた人ラーメン屋の人みんなヒカキンさんを支えてヒカキンさんをこんな大物にまでさせてくれてありがとう
0.927456319,ヒカキンさんのガチファンだから泣くくらい嬉しい一生買う
0.927443445,youtube続けながらもこれを着と進めていたと考えると本当にすごい
0.927243769,サムネ変えるところとかさすがだなと思う常youtubeのご報告サムネには嫌気がしているので発売まであと0日たのしみー
0.92722708,ラーメンの方をさっき喰ったけどイマイチだねごつ盛り味噌の方が好みだわ
0.927103102,ここまで人が良いと過去にどんな重罪を犯していたとしてももうなんでも良い許される
0.927095473,もう美味すぎて鳥肌たったわラーメンも美味いけどメシがやばいくらい美味しかった
0.927062809,初めて発売される商品って言い方だと次もあるのかな
0.927048028,なかなかいないと思いますが私ラーメンが苦手なんですよそれでも全然食べることができましたhikakinさんありがとう
0.927015305,ラーメン好きならなんでアセスルファムカリウム入れたのかが疑問
0.927004457,美味しそうやばあ夜の0時食テロすぎぜったいたべる
0.926986873,hikakinさんの元気が出て嬉しく思います
0.926918864,これは売れる口角が上がる感覚わかりますさっそく0日からセブン見てきます
0.926881135,0品目はノリが完全に某j熱大陸みたいで面白い脳内で葉加瀬太郎のバイオリンが聞こえてくる笑これで0分やって欲しかった
0.926823318,勝手に期待しといていざ発表した時文句言うのは違うだろ素直におめでとうでいいでしょ
0.926763773,こんばんは今セブンイレブン行ったら店員さんが並べててさっそく買って食べましためっちゃ美味しかったです
0.926751971,蒙古タンメンがライバルかな辛いバージョンも出して下さい
0.926585853,味噌ラーメンで良かった他の味だと食べないので食べてみます
0.926510453,両方買いましたカップ飯美味しすぎてリピート確定です明日はラーメンの方も食べてみます
0.926485896,店舗じゃないところがまたyoutubeの身近さを感じましたなんか泣きそうになったおめでとう
0.926383555,自分の好きな料理を自分が手を加えて商品として出せるのって本当に凄いことだよなぁ
0.926289141,ヒカキンさんみたいな人も最初は苦労してたマジ尊敬
0.926177025,プレミア公開の時コメントで文句奴多すぎて悲しくなったわ素直に祝ってやればええやんけ
0.926107049,心からおめでとうを言いたいですほんとに自分の夢を次から次へと叶えていて憧れでしかないです僕も頑張ります
0.925975263,濃厚味噌で香味油白味噌使用麺処くるりが本当に好きだったんだなって分かるわな
0.925855458,つよぽん絶対に0月0日買ってみようかな超美味しそうだね
0.925826192,ラーメンとメシ両方食べました確かに元気を貰いました
0.925747454,再生回数見て思ったけど今でもみんなの関心を惹き付けてる事が凄いちゃんとみんなhikakinの事気になってるんだね
0.925742924,hikakinが生きてる時代に生まれてこれて良かった
0.925671279,エビとかカニを入れずにアレルギーの人でもなるべく楽しめるように作ってるの好き
0.925645709,0番びっくりしたのがhikakin様の書道が想像以上に上手かったこと
0.925605059,hikakinの夢が叶って本当に良かった
0.925587177,hikakinさん花月嵐ラーメン屋に行ってくださいお願いします
0.925584853,だからラーメンダーツとかやってたんだね好きなものを本気にできるのって本当に尊敬できる
0.925568521,これ辛いの麻婆豆腐しか食ったことのない中学生でもくえますか
0.925531805,好きなことにここまで全力を注げるのも聖人と呼ばれる0つの理由なのかもな
0.925454021,発売おめでとうございます食べるの楽しみです
0.92538619,同年代でハモネプやってたって思うといつも鳥肌というか感慨深くなりますˇˇ
0.925349891,向上心あって素晴らしいラーメン旅もしてるくらいだから好きなんやね
0.92530185,泣きそうになるくらい相変わらず感動しました
0.925259352,発売が楽しみすぎて毎日見てます見れば見るほど美味しそう
0.925226927,発売したら食べたいですねでもすぐに売りきれそう
0.925163627,これは絶対買って食べますラーメンは本当に食べると幸せになりますよね
0.925160527,カッコよすぎる絶対に買います味噌ラーメン好きなので早く食べたいです
0.925049543,発売決定おめでとうございます0月0の発売日に0つとも買いますこれからも応援してます頑張ってください
0.925026834,hikakinさんが休止したと聞いてどうしたのだろうかと見に来たけどいつ見ても安心するすごいhikakinさんで安心した
0.924970448,いやすごすぎるわyoutube活動だけでも忙しすぎるのにその合間を縫って自分の夢を叶える活動をするなんて
0.924897194,ほんとまだ全然人気出ない頃にヒカキンを友達から勧められて観てたけどそのヒカキンがいまこうしてhikakinpremiumのラーメンが出るそして今となってはyoutube界を代表するくらいの人となってるほんとにすげーこれからも応援してます
0.924810886,人気出過ぎて売れ切れなってそうだから早めに買いに行こ
0.924768567,0月0日孫とパパは0の店を探し回りましたしかしみそキンラーメンはありませんでした販売は終了したんと違うかなとパパの言葉ラーメンはもう食べれないのでしょうか
0.924684227,これだけ成功してても夢に向かって走り続けて実現させるとかカッコ良すぎる一人の人間として尊敬
0.924654841,ラーメン店にするの飲食だからインスタントより異物混入系の事件が起こりやすくなるから絶対こっちの方がいいよね
0.924651682,コンビニで買えるのは嬉しいヒカキンさんの本気のラーメン絶対食べる
0.924638331,ミソキンラーメンの残り汁にご飯いれたらミソキンメシにならんの笑
0.924566925,この人はたった一週間の休みのために盛大にみんなのことを考えてるんだなこの人こそ本物の聖人だ
0.924529374,僕もラーメン大好きです僕もラーメン作ってみたいなあ田舎なので買えないですけど旅行行った時買いますね
0.924282432,白味噌を入れることによってガツンとくる旨味が鈍くなる気がするけどどうなんだろうか早く買って食べたい
0.924220741,こんな素敵な人本当に居ないしもうほんと大好き頑張ってほしい
0.924200594,0から0にするのってホント大変自分の夢を実現させる努力すごい
0.924196243,まだ食ってないからなんとも言えないけど自分の知名度を利用してなんとなくな気持ちでラーメン作りに手出したとしか思えないしほんとにラーメン作るのが夢だったんなら自分の名前を公表せずにこっそり作って周りからの意見を忖度なしでもらって初めて嬉しいって思うんじゃないのかな知らんけど
0.924112499,お身体に気をつけてくださいね次はほんとに0ヶ月くらいお休み取ってくださっていいんですよー
