0.893239141,早く発売されないかなー早く食べたい
0.893214583,美味しかったですー
0.893172383,一店舗0食しかないのって本当ですか
0.893158615,むしろしょーもなでバズる目的だった説
0.893153667,自分の好きな商品を自分で監修して商品として販売できるなんてすごいな
0.89312607,全年齢対象にしてるの流石やな
0.89304322,甘めって事はミサに近いのかな
0.89285332,それ休みじゃねぇだろちゃんと休めよ
0.892830729,これを見ながらカレーメシを食う
0.892708838,ラーメン聴きすぎてゲシュタルト崩壊起こしそう
0.892667115,こんな時間に見ちゃったからお腹すいた
0.892579556,具材がくるりのラーメンぽいのも感動でしかない笑
0.892406285,招き猫キンに出会えたよー
0.892321169,発売日へずまの誕生日なんだが
0.892295063,緊張するなでも最大限応援します
0.892149627,これからも夢を叶えて夢を俺たちに見せてくれ
0.892132282,聞く前から嬉しくてドキドキする
0.892082036,発売されたら即食べたい
0.892069161,ファミマローソンでも販売して欲しい
0.891808689,さっき買ってきたよー
0.891759574,グッズ系じゃなくてラーメンメインなのが個人的に嬉しい
0.891652346,両方とも必ず購入しますっ発売日が楽しみ
0.89161092,これはさすがに食べたい
0.891281307,コレは一度は食べたくなる
0.891231477,コンビニ行ったら0日早く売ってました美味かった
0.89121294,ラーメン大好きだから必ず食べます
0.891111016,お母さんがかってくれました
0.891086221,trendhikakinpoint久しぶりに聞いた
0.891085088,いいねの数だけそれぞれ買います
0.891042411,無事に買えた結構残ってたので友達と買った0人で喜んだ
0.890890479,いいねの数だけそれ買います
0.890786052,いっそのことラーメン店作りそう
0.890699863,美味しくなさそう買うけど
0.890636206,美味しそう食いてぇー
0.890625,友達と今度買いに行くらしいので俺も買う
0.890182674,俺の誕生日0月0日や発売日と同じ日なんてこれ以上に最高なことは無い
0.890159965,味普通やんサッポロラーメンのほうがうまいわ
0.890142441,ヒカキンさん塩分0はやべえって
0.890014172,好きだけどなんかお金配るのは
0.889956236,なんかもう嬉しい泣ける矢部
0.889738619,早く食べたいです
0.889736414,下積みって何回言ったか数えてる人います
0.889706731,ほかのyoutuberとは違ってラーメンなのいい
0.88954711,やっぱり一周間はえーな楽しみ
0.889338732,ヒカキンゲームズのホームから来た人
0.889337003,みそると対抗して欲しい
0.889249504,しおきんとしょうゆきんも食べたい
0.889104664,うわわ美味しそうすぎる絶対買う
0.88897109,たいしたファンでもないけどなんか涙出るね
0.888932645,塩分多すぎ一日の目安思いっきり超えてる
0.888533533,美味しそう発売日楽しみです
0.888509333,再販決定と聞いてまた見に来てしまった
0.888458133,ヒカキンが青色の服着てると嬉しい
0.888248324,こんなに頑張って作ったら買うしかないよね
0.888184369,必ず買います美味しそう
0.888091862,再販してくれるのが嬉しい
0.887863696,味噌ラーメン大好きだから嬉しいー
0.887807429,hikakinさんセブンイレブンなかった
0.887677491,人工甘味料に驚き
0.887614548,ラーメンの方が私は好みです
0.887476206,みんなあんま触れてないけど習字上手ない
0.887343705,再販でやはり闇を感じた
0.887255132,美味しそう絶対食べます
0.88700223,これは普通に感動したわ
0.886952341,アンタ味見してるだけやん
0.886764824,商品紹介のプロが自分の商品を紹介するのすごい
0.886761844,次は濃厚豚骨でお願いします
0.886703014,そうなんですね僕もラーメンが好きです
0.886531532,みそるからきましたー
0.886489928,これもいわゆるyoutube界の既得権益だな
0.88639003,マジでうまそう食べてー
0.886380672,見てるだけで腹減ってくるわ
0.886321068,美味しかったヒカキンさん最高
0.886089921,めっちゃ美味しかったです
0.886089921,めっちゃ美味しかったです
0.886089921,めっちゃ美味しかったです
0.885821402,鹿児島はいつぐらいになりますか
0.885810137,とりあえずススル君に土下座しな
0.885741055,努力は人を裏切らないとはこのことなのか
0.88568449,スーパーで商品を並ばせる側だったのが並ぶ側になったのが凄すぎる
0.885607243,めっちゃ探したけど買えなかった人
0.885388076,美味しかったです
0.885388076,美味しかったです
0.885388076,美味しかったです
0.885283053,hikakinが休んでいい日にち
0.885272503,様なバラエティーヌードルも期待してます
0.885181189,ヒカキンは何回ラーメンと言ったでしょう
0.885175347,ラーメンとかtシャツとか誰でも買える値段にしたとこに好感もてる
0.885113597,不味すぎ0からやり直せ
0.885026634,どんな報告かなどんな報告でも神回だ
0.885010421,好きだったラーメンを作るなんてすごいな
0.884518206,ラーメンの方が美味しかったです
0.884440422,待って今食べてたら蓋当たりあった
0.8841573,絶対買いにいくー
0.884126246,本当に美味しかったです
0.884069145,いいねの数だけ0万スパチャ送ります
0.883869708,他のラーメン作ればいいと思うな例えばしょうゆきんしおきんとんこつきんとか作ればいいじゃない
0.883842587,hikakin自分で自分を超えちゃったかな
0.883764386,新潟のニューミサが混むぞー
0.883761644,醤油ラーメンも作ってくれませんか作ってもらえたらうれしくていっぱい買います
0.883476019,ヒカキンさんって本当にいい人だなぁ
0.883364558,生半可な気持ちでやらないで
0.883175611,売り切れだったたべてぇ
0.883124232,らーめんもいいがもうそれ以上太るではないぞ
0.883106828,あらたなレさキャラの誕生
0.883097947,醤油バージョンも出してほしい
0.883094251,休むほどのことかよく解らない
0.883049369,ラーメン美味しかったです
0.882756114,また味噌キン再販しますか
0.882542729,今回のやり方は常識的にグレー過ぎるぞ
0.882476151,応援しとるで絶対買うわ
0.882372618,味噌味以外も出してほしい
0.882298768,今後色んな味出して欲しい
0.882293642,めちゃめちゃ人気になるとは思わなかった
0.882075906,高い甘い買えないそんな印象だったなぁ
0.882015705,絶対買うしかないだろー
0.88201344,こんな期待したラーメンねえよ
0.881942153,メシの方が美味かった
0.881663978,ヒカキンさんのぬいぐるみがほしいですまい
0.881480396,めっちゃ美味しそう絶対買う
0.881362915,ええすごい買いに行くーおめでとうございます
0.881247938,絶対に行く待ってろよヒカキン
0.881232023,これにファイヤー流してほしい
0.88121587,買いたいけど売り切れてそう
0.881083369,いい歳したおっさんがこれレジ持ってきたら笑うわ
0.881037474,この人はマジで凄すぎるよ
0.881009877,ラーメン大好きだから嬉しい絶対買います
0.880887806,ヒカキン開発とか向いてそう
0.880787969,コンビニで買えるのが嬉しいです夢を叶えるってすごいです
0.880695641,うへへ0円広いやしたラーメン0杯いただきやす◎
0.880568027,とっても美味しかったです
0.879968703,どうでもいいけど0時間で0万回再生はやべえな
0.879881561,夢ビートボクサーじゃないのか
0.879709065,これこそ好きなことで生きていく
0.879496634,あまりにも本気すぎて勝手に感動した
0.879339814,すげぇなぁやっぱ出来る人は何に手を出してもやり遂げるんだなぁ
0.879260898,夢がついにだなおめでとうヒカキン
0.879116535,復活おめでとうございます最高
0.879113495,これは絶対美味い
0.879046202,買うことができるとは言ってない
0.878918529,今日徳島のセブンで0個買った
0.878649771,あんなしっかりもやし入ってることあるんや
0.878174484,買いにいったけど売り切れだった
0.878138244,あれこれご報告のサムネがちがうは
0.878081739,食べたすぎる待ちきれない
0.877882361,しょーもなとか言ってる人人の夢をそう思うことがしょーもないと思うよ
0.877843022,おめでとうございますたくさんたくさん売れますように
0.87781316,いい報告であってほしい
0.877460539,夢を現実にするのカッコいい
0.877191126,どんな報告かめっちゃ楽しみ
0.87708956,買いに行きます
0.876830876,鳥肌とニヤケがとまらんなんかすごい
0.87665695,売ってないやんけ0店舗まわったのに
0.876618445,涙出そうになりました
0.8766011,普通の味高い買わない方が良い
0.876347244,なんか0年くらい見てるけど感動するわ
0.876317739,ちょっとたべてみたいです
0.876258075,プルが過去一気合い入ってる
0.876195073,絶対食べたいお腹すいた
0.87613529,夢をちゃんといつも叶えていくのがかっこいいおめでとうございます
0.876126647,美味しそう食べたい
0.876126647,美味しそう食べたい
0.876113057,うぅえーんアタチも食べたい
0.876014531,本気度が伝わってくる
0.87594837,凄すぎてもう凄いしか言えなくなっちゃった
0.87579304,pvのあとの真顔おもろ
0.875778139,美味そうー絶対買います
0.875641584,感動しました絶対買います
0.875634015,hikakinってたまに見るとほのぼのしてふふってなれるなんか疲れてたけど少し心穏やかになれたhikakinありがとう
0.875363708,0時間で0万再生やはりyoutubeの王だったか
0.875294149,中野来たら札幌ラーメン味七上手いから食べてみて味噌ラーメン
0.875177503,ヒカキンさんわたしもたべました0さいのはるとよりヒカキンさんだいすきですよ
0.875126183,今日食べてみたけどめっちゃおいしいよ
0.874906242,小麦アレルギーあるからご飯あるのはありがたい
0.874875784,ヒカキンのラーメンめっちゃおいしかったです
0.87487179,結局休んでなかったことが判明
0.874498904,美味かったです
0.874498904,美味かったです
0.874407291,0時間以内で急上昇ランク0位になったのがやばい
0.874135792,買えない人おいいからもっと売って欲しいです
0.874133527,なんなら店舗出してくれてもええんやで
0.873754323,ひかきんさんすごい字が綺麗
0.87373966,はやく食べたいわоо
0.873640716,発売日0日から0日に変わってるんだけど
0.873474956,うんoemかまぁたべてみるよ
0.873304129,私まねきねこきん出ました
0.873297095,絶対食べますね
0.873264194,近所にコンビニがコンビニがねぇ
0.873124719,セブンイレブンに行ってもなかった
0.872855008,シンプルにバカ美味そう
0.872638464,幼なじみyoutuberhikakinさんマスオさん
0.872136056,ラーメン専門店より美味かった
0.872104764,0えっ凄っ絶対に買う
0.871833682,食べるの楽しみ
0.87165612,食べてみたいー
0.871549785,努力が凄すぎて俺も頑張ろう
0.871509612,百万円くださいちなみに場所はまるまたしょうてす
0.871414661,いいねの数だけ買います
0.871414661,いいねの数だけ買います
0.87140286,報告が楽しみな人
0.87128216,ずっと夢を追い続ける姿痺れます
0.871273041,誕生日に発売嬉しいですˎˊ-絶対買うしかない
0.871245861,ニューミサとどっちが美味いですか
0.871115029,売り切れ続出しそうだな
0.870987177,前回より明らかに彩度上がってる
0.870917916,麺の硬さが気になって
0.87040621,ポイントつける側からつけられる側になったの凄すぎ
0.870252907,沖縄のセブンにもあるのかな買いたいな
0.870238185,貴族の拍手だけが気になる
0.869896293,食べたけぞどすくうはうますぎる
0.869359672,ビックダディって言ったの誰
0.869282246,最初のオープニングをhikakintveveryeekでも許される
0.869241476,めちゃ美味しかった
0.868991435,両方食べました最高に美味い箱買いしました
0.868849814,好きなものがあるって大切なことなんだな
0.868713021,ヒカキンさんテアロシップウダンがゲロキンといっました
0.868617356,招き猫あたった
0.868463337,この量で0円オーバーは高すぎだろ
0.868410766,めちゃくちゃ美味しかったです
0.8679986,そんな美味くない
0.867986381,セブンイレブン以外のお店でも売れますか
0.867952347,ラーメン屋に勝てるわけなくて草
0.867935658,食べてみた人
0.867751718,セブンないんよなー生協かイオン系列で売ってたら買う
0.867564023,失望したもう二度と買わない
0.867552519,ストーリーマーケの事例として勉強になる
0.86738652,絶対誰も予想しない結果で草
0.867347002,普通に美味かった
0.867347002,普通に美味かった
0.867299616,いよいよ明日かホント楽しみ
0.86727351,ガチこれ美味すぎ
0.867258191,そのラーメン買いたくなります
0.867091298,0年になっても見てるやついる
0.86703378,そのうち袋麺も出してくれ
0.866829216,いつでも好きな事に全力なヒカキンさんやっぱり好きだなぁ
0.866610527,速報田舎売ってない
0.866322994,ラーメン食べてみたよ
0.866293848,普通に美味しそう
0.866266668,ひかさんがふくよかになった理由
0.866079569,これほんとに美味かった
0.865978956,ヒカキンいつもみてるよあいと0さいより
0.865769148,jalの機内食にしておいしい
0.865612924,なんな涙出てきた夢って叶ったら凄いよなぁ
0.865430236,さきないとさんコメントきましたありがとうございますきました
0.865352809,全然売ってないんだけど
0.86524266,youtuberのプレゼント企画は税金対策だよな
0.865181446,店舗じゃないのかよ
0.865088642,うまそうだけどちょっと高そう
0.865084589,やばいクレーマーみたいなポーズ
0.86497277,どんな味がするのか一度買ってみようかな
0.86477226,どうせしおきんとか増やすんでしょ商標取っとこ
0.864746749,蒙古タンメン買おっと
0.864739656,カップの中に箸差しっぱなしなの嫌だ
0.86468178,これみながら食いたい
0.86467737,夢叶うってめちゃくちゃいいことだね
0.86467433,食いたくなってきた
0.864365816,0月0日絶対見つけたら絶対買いに行く
0.864238024,hikakinさんすごいこれからも頑張ってください
0.864175022,hikakinさん頑張ったな
0.863939226,絶対食べなきゃ
0.863905191,どうしても早く食べたい
0.863852441,後半ドキュメンタリーみたい素敵
0.863737702,手に入れられないんだけどずっと売っててくれんかな
0.863268435,0万円てぼったくられてるよ
0.863054514,店員側から出品側もやるなんてすごい
0.863050759,めっちゃ美味かったです
0.862944603,みそるから入りました
0.862944603,みそるから入りました
0.862944543,かうと思った人
0.862564147,本当に真面目な方やな尊敬するわ
0.862031162,めちゃめちゃ食べたいです
0.861744702,バンカラジオさんもコントでやってましたよ
0.861623526,あそひかりラーメン作りたいです
0.861553013,岐阜県のみんなにとどけておねがい
0.861498415,台湾ででもでも買いたい
0.86128217,めちゃくちゃ美味かったですこれからも頑張ってください
0.86091429,今日から発売じゃないか買えたら買うzoy
0.860741258,サムネが変わっておる
0.860360682,もう絶対買うんだけど
0.860316873,税金対策も兼ねてるのかな
0.860161662,セブンイレブンって時点で買う気せん
0.859913588,youtuberの師匠って感じです
0.859295309,夢って叶うのね
0.859276235,めっちゃ食べたい食べてみる
0.859078407,くるりインスパイア系なのかな
0.858617902,hikakin様最高
0.858497858,普通に習字上手い笑
0.858435631,尊敬する人物hikakinレーニンゴルバチョフ
0.858000696,休むとこが動いてて草
0.857876837,ニューミサのラーメンはほんとおいしい
0.857719123,口角が上がるラーメンってすっごくいい
0.857520998,ナレーションのトーンがほん怖
0.857471704,ヒカキン頑張れ
0.857451975,しょうもなって言ってるやついるけどどこが
0.857339323,売ってねぇ売り切れてら
0.857267559,この努力は絶対報われるファイト
0.857169986,ヒカきんさんこーださんしってます
0.857149005,明日買いに行く人
0.856795013,コンビニで買えるのはいいですね
0.856375217,試食の時口ピチャピチャさせない
0.855878532,食べたーい
0.855878532,食べたーい
0.855878532,食べたーい
0.855492532,醤油キンも欲しい
0.855450809,いつかラーメン屋さん作りそう
0.855407655,夢に本気になれる聖人youtuberの鑑
0.855354726,普通に美味そう
0.855271041,どんな報告でも応援してます
0.855238557,普通でした
0.855238557,普通でした
0.855061114,ヒカキンさん大好きです
0.855055273,ぼくはごさいですたべたいです
0.854984879,この調子でしょゆきんとしおきんととんこつきんもだしてくれ
0.854847848,サムネ変えたか笑
0.854370356,そんなんたべるしかないでしょ
0.854349196,よっかたですねゆめがかなってぼくもたべたいですどうががんばってぐださいぼくもおうえんしてます
0.854307055,どこまで行ってもめちゃくちゃ優しい人だなあ
0.854211748,夢を諦めないこそ人生
0.854014099,ヒカキンあんたやっぱすげぇよ
0.854006767,視聴後いや休んで無いやん
0.853931427,夢の味買います
0.853923857,控えめに言っても神
0.853741944,誕生日だ絶対買う
0.85360378,みそるから来た人
0.853318155,みそるからきました
0.853134215,いつまで活動休止するの
0.853089869,絶対に買います
0.853036046,好きなことで生きるってこうゆうことなんだなぁ
0.852975309,早く発売してほしい
0.852890968,この人はどこまで素晴らしいんだ
0.852815211,ヒカキンってすげーなー
0.852302074,戻って来てくれてありがとう
0.852224529,ヒカキンおもれー
0.852151215,しおきんお願いします
0.852103114,どんな結果でも大好きだよ
0.851950467,映像比べに来ました
0.851706147,再生数が0万人いって欲しい人
0.851575792,ガツッとくるカップ飯楽しみ
0.851419508,塩ラーメンだとしおきん豚骨ラーメンだととんきんじゃあ正油ラーメンだとせいきんになる
0.851180673,コンビニで見かけたら絶対買うしかない
0.851152778,絶対食べます
0.850844145,絶対かぃますoどっちとも
0.850812495,この人ほど純粋な人おらんと思う
0.850782573,地元に味噌吟とゆうラーメン屋がある
0.850635707,もはやyoutuberがやることじゃないすげえなあ
0.85051924,発売待ち遠しい
0.85017097,早く食べたい早く発売しないかな
0.849955678,ヒカキン字上手いね
0.849426985,マスオtvありますか
0.849310756,みそる美味しそう
0.849054158,アレルギーがあるから食べられない
0.848873734,ラーメンゲシュタルト崩壊したわ
0.848851323,一度は食べてみたい
0.848623872,あしたからだ楽しみ
0.848534763,これは絶対買う
0.848433554,美味しかった
0.848067164,めちゃ早く食べたい
0.847842872,無いからまた売れや
0.847812831,ヒカキんさんだいすきですゆうと0さい
0.847755194,ヒカキン習字うまい
0.847593427,本当にこだわりを感じる
0.847574413,もう一つの夢だったかっこよすぎ
0.847381175,感動しました
0.847381175,感動しました
0.847189963,発売日に絶対買う
0.847132027,ちゃんと美味かった
0.846897781,他のあじもつくってほしい
0.846445024,本当にこの人尊敬する
0.846299589,とりあえず食べまーす
0.846271038,ヒカキンさんはじめまして
0.84618324,こんなん買うしか無いやん
0.846123993,送金美味しそう
0.845922112,休むどころか働いてて草
0.845648587,もー映画にしていいぐらいすごい
0.845442653,くっそ美味そう
0.845216155,ちぢれ麺がいいね
0.845152855,これが洗脳か
0.844894528,んーこんな感じか
0.844832838,めちゃ美味しそう
0.844640434,絶対買うは
0.844316065,youareamazingcan'taittotryyourramenintheus
0.844041884,テュデイズヒカキンズポーイント0兆万点
0.843885362,あとコーラも大好きだね
0.843720496,0回食ってみよ
0.843605042,これは食いたい
0.843509018,0個ずつ買いたいなぁー
0.843333721,0万食は確定してるな
0.843014359,ヒカキン習字上手い
0.842995584,みそふの方がいい
0.842816591,結構期待はずれ
0.842315257,グットボタンおしてね
0.841826379,買うの恥ずい
0.84179002,成分公表してほい
0.841598868,今夜の夜食にします
0.841520607,絶対買います
0.841520607,絶対買います
0.841520607,絶対買います
0.841520607,絶対買います
0.841520607,絶対買います
0.841520607,絶対買います
0.841178536,絶対明日食べる
0.84064889,買いますおいしそう
0.840585947,食いたいけどたけぇよ
0.840230346,面白いですね
0.839995742,食いてー
0.839905739,めっちゃ美味かった
0.839699209,しおきんもほしいなんにせよおめでとうございます
0.839234948,戻ってきた
0.838875294,題名変わってて草
0.838494599,宇宙じゃないんかーいっ笑
0.838282824,実質休んでない
0.838163316,美味しすぎた
0.837908745,ありがとうございます
0.837908745,ありがとうございます
0.83783412,食べたいー
0.837756097,おっきくなったね
0.8376562,早くブラジルにも届くといいな
0.837505519,容器だけで0円しそう
0.837420464,ミソきんさんだ
0.837290823,次はラーメンチェーンですね
0.836212218,えーすご自作やば
0.83550179,また小銭稼ぐの
0.83538729,今から間に合いますか
0.834644616,ヒカキンさんおめでとう
0.834414601,ヒカルマネしてて草
0.834126055,買わない訳が無い
0.833757401,すてき食べたい
0.833691955,不味すぎ返金しろ
0.833582282,食べるね
0.833293319,みそかみそきらいなんよ
0.833132744,楽しみです
0.833112359,おめでとうミソきん
0.832936406,ひかちゃんおめでとうございます
0.832895875,美味しそー
0.831938982,高いッッ
0.831935167,もっと休んでくれ
0.831884086,ラーメン食べたい
0.831531882,普通に食おう
0.831230521,蒙古タンメン買おう
0.83084017,両方とも買えました
0.830753446,ぼくもラーメンだいすきです
0.830561459,おめでとうございます
0.830561459,おめでとうございます
0.830561459,おめでとうございます
0.830499351,めっちゃうまかったよ
0.830347121,スープうまかったで
0.830247939,早く食べたい
0.830247939,早く食べたい
0.830247939,早く食べたい
0.830247939,早く食べたい
0.829626918,メンマ好きにはたまらない
0.829617679,サムネ変わってる
0.829371452,売ってないんだわ
0.829317927,サムネ変わった
0.829020083,食べなきゃ
0.828024626,休んでないやん笑笑
0.827012718,もっとゆーちゅーばーになってくださいゆうと0さい
0.826823771,ちょっとうまそうなの草
0.826780021,どこにも売っとらん
0.826505244,習字普通に上手い
0.825773835,しょうゆきん作れ
0.825705647,絶対買う人
0.825705647,絶対買う人
0.825614452,わたしもらーめんすきだよ
0.824037135,ラーメン食べてみたい
0.823892474,ラーメン作りたい
0.823863089,売ってないぞー
0.823484004,これくらいやろ笑
0.823015273,美味しそう
0.823015273,美味しそう
0.823015273,美味しそう
0.823015273,美味しそう
0.823015273,美味しそう
0.823015273,美味しそう
0.823015273,美味しそう
0.822790802,これ作る為に0年の新曲出さなかった説
0.822247028,セブンイレブンにありませんでした
0.822241306,セブン店員だから買おー
0.821428835,絶対買ってやる
0.821205318,はやく買いにいこ
0.820897579,僕買いました
0.820887983,ちょっと高いけど絶対買う
0.820475876,スター気取り
0.820374787,スーパー美味いって
0.819946468,普通に買うわ
0.819294095,マジでうまそう
