0.95639199,hikakinさんの作られたラーメン美味しそうで食べたいなと思いました
0.953870773,お店を出すのではなく全国民が気軽に手に出来るようにセブンで販売するところがヒカキンらしくて心暖まるね夢に向かって努力して実現したヒカキンを誇らしく尊敬する
0.952585518,深夜に見なきゃよかった美味しそうすぎる味もそうだけどhikakinがラーメンと一緒に色乗り越えてきた想いを聴くと自分もそういう日に食べたいと思った楽しみ初日買います
0.951798677,早速食べました絶妙なバランス美味しかったです0年間試行錯誤された甲斐があったと思いますごちそうさまでした
0.951168478,キン兄弟がラーメン大好きなのをずっと見てきたからこれほど信頼における商品はないと思ってます絶対食べたい争奪戦になりそうなのでゆっくり手に入れますね笑一つ夢を叶えること本当に素晴らしいし勇気をもらえますおめでとうございます
0.950381339,これは売り切れなるだろうなー買いたい名言食べ終わったら容器は綺麗に保存だほんと美味しそうで
0.950255513,これだけ魂込めて完成させたラーメン本当に凄いです発売日に近所のセブンイレブンにも並ぶかな田舎だから地域差ありそうですよね見付けたら絶対食べます楽しみです
0.949792087,豚骨派だけどヒカキンが作ったなら味噌ラーメンも食べたいと思う味噌ラーメンも好きになりそうてかそう思わせてくれるヒカキンのこれまでの努力がすごい
0.9493922,ラーメン本当に大好きですhikakinさんをずっと前から見てきました小学生だったけれど今はもう高校生で大学受験に向けて勉強しいます勉強のお供として食べていきたいです
0.949329495,hikakinさんのラーメンに対する本気が伝わりました発売が本当に楽しみです
0.949297845,好きなものを自分の商品にしちゃうっていう偉業ほんとにすごい0年かかったり活動休止になるのも頷ける
0.948979378,いくら企画とはいえしっかり色と研究して自分なりのラーメン作ってるのがすごい尊敬するわ
0.948741317,hikakinさんが嬉しそうに楽しそうにしてて元気でるなーアレルギークリアしてたら買って食べます無理だったら誰かにプレゼントします
0.948458314,好きなことをして人生を楽しんでいる姿に私も頑張りたくなる気持ちが出たよyoutuberの鏡だよ
0.948423326,正直かなり楽しみ自分の口に合うかはもちろんわからないけどhikakinさんが思う至高の一杯がどんな味なのかは食べてみたい
0.948321939,自分の夢の中にみんなを笑顔にしたいという想いが込められてるのって本当に素敵優しさが味にも出てそう
0.948000908,勝手に報告だとばかり思ってたから予想外すぎたけどヒカキンさんのyoutuberとしての夢とは別の夢が叶って本当に嬉しい
0.947629809,このラーメンを同じように元気が無い時腹ペコの時ヒカキンさんの話を思い出しながら食べたいと思いますインフルエンサーの方で夢を叶えたと聞いてこんなに本当に良かったここまで長い道のり努力と信念つらぬいたんだなって感動したのは初めてかもです
0.947423518,夢を叶えたいことを叶えるhikakinさん本当に凄い息子もラーメン大好きなので発売されたら即購入して食べますね
0.947418451,美味しそう自分の作品にこんなに自信もてるのかっこいい早く食べたいなあ
0.94713968,朝一買ってセットで食べましたどちらもすごく美味しかったです味噌ラーメン好きな方には本当におすすめです
0.946998596,密着映像見てすごくこだわったのが伝わってきてラーメンの中で味噌ラーメンはあまり食べないけど食べてみたいと思った
0.946955562,大好きなラーメンが作れるくらいビッグな男になったヒカキンさんマジですごい他の商品も当たり前だけどこうやって試作を重ねて作られてるんだなぁと思うとなんだか感動しました絶対食べたい絶対見つけ出して食べます
0.946318686,これあれだねスーパーでも発売して欲しいくらい食べたいです僕も小さい時から0年生まれなんですけど味噌ラーメンが大好きで近くに札幌ラーメンがあって毎日のように言っていますそれぐらい味噌ラーメンが大好きです
0.946240187,好きなことで生きているを体現したまさに偉人私たちに夢を与えてくれて本当にありがとう
0.945955276,しょうもないとか言ってる奴ら人の夢を0文字で片付けるなよhikakin本当におめでとうこれからも一生ついていくわ
0.945824146,私が人生で救われたのはポケットモンスターhikakinの気持ちよく分かります
0.945689797,きっと想像を絶する苦労をたくさんしてきている中で本当にラーメンに救われて心からラーメンが好きなんだろうなとひしひし伝わるその思いは決して軽いものではないのにみんなが元気になれるようにって誰でも手に取れるような値段と店舗展開でみんなに共有してくれて聖人すぎる
0.94553256,是非食べてみたいヒカキンさんをずっと支えていたラーメンこだわり抜いた一杯を食べて元気を貰えるといいなぁ
0.945500851,ヒカキンは今回夢を叶えたけどヒカキン自身もまた色んな人の夢になってるんだよね素敵な世界だ
0.945359945,こういう有名人が関わる商品って大体ちょっと口出すくらいで後は全部任せるって感じの印象だったけどヒカキンはめちゃくちゃ従事しててやっぱこの人違うなって思ったわ
0.94529736,はよ食べたいおめでとうございます夢を叶えていく瞬間をこうやって見ることが出来て同じ時代生きれて幸せです刺激もらいました
0.945058525,普通に美味しそうだし一般市民に気軽に手に入りやすくて凄くありがたいです買いますね
0.945038021,体質がらラーメン小麦粉が食べられませんがメシも出してくれたなんて心から応援いたします
0.944727421,白味噌も入ったベースのニンニクのパンチあるラーメンの味の意味がわかりましたニューミサ僕も大ファンですコレは試してみたい
0.944355369,いろんな意見があると思うけど自分はヒカキンさんが心を込めて作ったんだって信じてる
0.944276154,ラーメンなら手軽に買えて嬉しい一つ一つのことに真剣に向き合う姿は尊敬しかありません他のyoutuberを非難するわけではないのですがいつも全力で取り組んでいて結果がでているのも納得です
0.944258809,しょうゆラーメンが美味しすぎて味噌ラーメン食べたことないのに凄く美味しそうこれは買いだな
0.944242001,学生だからyoutuberとかが出すものって高いけどhikakinさんは学生の気持ちも考えてくれたのか0円という化学でこだわりのラーメンが食べれるのは楽しみです友達と買いに行きます
0.944139242,ただ発売するのでなくラーメンに助けられた感動的なエピソードがあるのがやっぱりヒカキンさん神だなって思う
0.944005191,東京にラーメン店を開くとかじゃなくて手頃な価格で全国で買えるカップ麵にしたところがヒカキンって感じして好き
0.943863153,僕らに出来る最大の応援は買って美味しく食べるこれに尽きると思ってます絶対食べます
0.943626702,今日比較的のどかな地元のセブンで買おうと思ったら残念両方売り切れてました美味しそうなのでそのうち是非購入したいです
0.943552673,若い頃に死ぬ程努力して今夢を叶えたり今の成果があるそう思うとやっぱりhikakinさんには憧れる僕もサボってばかりいないでひと踏ん張りしてみようかな
0.943394125,今日初めて食べたなんかカップでいける味噌ラーメンの限界に挑戦してるといえる味だったこれはリピーターいるワケだ
0.943092406,他のyoutuberがやるぼったくりアパレルとかじゃなくて本当に自分がやりたいことを実現できるのは尊敬です゚゚
0.943006456,このラーメン食べるために一日頑張れる日が自分にもあるんだろうなと思うと嬉しいどうにか生きてる自分でもギリカップ麺に出せる値段で嬉しい
0.94291389,自分の好きなラーメンをいつも見てるhikakinさんが作ってくれるとは思ってもいなかった勉強の夜食に食べます0日は朝イチでセブンに直行だ
0.942739129,叶えたかった夢を実現するためにyoutube活動で忙しい中でもこだわりながら商品開発してきたって本当にすごい
0.942697525,内容がなんであれ夢を叶えるってのは普通の人ではなかなか成し遂げれないことだからほんとに凄いと思う
0.942590177,味噌ってのがいいですね食べてみます次あれば豚骨も期待してます
0.942564785,hikakinさんが美味しく食べてるのを見ると発売が待ち遠しいし早く食べてみたいー
0.942349255,youtube黎明期から変わらない安心感のあるコンテンツを続けているhikakinさんに拍手を送ります夢の取っ掛かりがかなったのでこの夢を更に大きくしていってくださいいつまでも応援してます
0.942291677,味噌ラーメンからもやしメンマネギ赤い調味油って感じがくるり意識してそうで好き
0.942268133,今日発売なのか売り切れてそうだけど絶対食べたいなこれを食べるために頑張って生きますっっง-ง
0.942124307,hikakinさんの投稿全然見ないんだけどヨダレ出そうになっためっちゃ美味しそう遅
0.941805124,この人は周りからすると小さな事に見えることも好きな事に諦めず取り組み続けてこうした結果を残せているから尊敬します希望の星です
0.941690624,食べました美味しかったですまた食べれることを楽しみにしてます
0.941173792,何度も繰り返し観ています観ているだけで気持ちが幸せになるhikakinさんありがとう
0.941075623,こんな休みのない多忙の中でラーメンの商品作りも進めてたの凄すぎでしょ絶対食べます
0.940890968,私も以前落ち込んでいた時ラーメンを食べてこの一杯でこんな幸せな気分になれるって本当すごいなぁって思ったの思い出しましたhikakinさんおめでとう早く食べれるの楽しみにしてます
0.940640569,hikakinさん売り切れてました食べてみたいので再販お願いいたします笑
0.940565348,字も綺麗なところまで本当にヒカキンさんの才能にびっくりですこれからもずっと応援してます
0.940558791,hikakinさんにほんとに元気貰ってますし尊敬してます0ヶ月入院してて大変ですが退院したら絶対食べますψ
0.94053638,おめでとうございます絶対に買って食べたいと思います本当に美味しそう急上昇ランキング0位素晴らしいです
0.940503001,0年ほど見続けていたのですが初めてコメントしますヒカキンさんがラーメンを作ったという報告が何故かめちゃくちゃ嬉しくて幸せで発売日に絶対食べたいです幸せそうに食べるヒカキンさんを見て笑いながら泣きそうでした
0.940432608,スープばり美味かったし麺もボリューム感じれてすすりやすいしバカ美味かったよ他にどれだけ批評されてても俺のコメントが全てやから大丈夫やぞhikakinさんバカ美味かったよ
0.940383792,うわぁあすごいよかったね絶対食べる夢に向かって全力で頑張る姿心から尊敬します
0.940315008,おめでとうございます0年間も私達の事も考え食べやすく美味しそうなラーメンを作って頂きこちらも凄く嬉しいです0月0日が凄く待ちどうしいです‪̖́
0.940129519,みそラーメン大好きだから嬉しいしかもセブイレならみんな買いやすいし絶対絶対買いますね今から楽しみすぎる
0.940114915,他のラーメンより美味いとかそういう言葉使わないのがやっぱりhikakinって感じがして大好き
0.939725995,好きなことを極められる人は本当に努力をしてきた人だと思います尊敬
0.939469099,ヒカキンは本当に充実してるなぁそうに決まってる
0.9394449,みんな恋人作ればリア充とか金持ちが自由とか言ってるけどヒカキンみたいな好きなことを本当に頑張れて嬉しさに溢れてる人が真のリア充だと思う
0.939415693,人生が変わるときもラーメンを食べてたはエモすぎる
0.939278722,自分の好きな事ラーメンで視聴者をも一緒に喜ばせれるのってhikakinさん位だと思う幸せを独り占めせず皆んなで分かち合える形に出来るhikakinさんはやっぱり凄い絶対買います頂きます
0.93917495,まずyoutubeを0年間休まずにやってるのだけでも凄いのにyoutubeをやりながら他の夢を実現させるためにも全力を注いで頑張るヒカキンさん本当に尊敬します
0.939113081,この人のこだわりましたほど説得力のあるものは無いよねめちゃくちゃ楽しみ
0.939086854,凄くこだわって作ったのもあってめっちゃ美味しそうちなみに白味噌派なので尚更食べたーい開発中大変そうだったけどもヒカキンさんがとてもキラキラしてて少年のようでした長年の夢のひとつの実現おめでとうございます発売を楽しみに待ちたいと思います
0.938885391,私も同郷なのであのミサのガツンと感のある味噌ラーメンは脳に刻まれてます笑おめでとうございます楽しみにしています
0.938840926,これこそホントのyoutuberだと思います誰かのことを取り上げるわけでもなく自分の夢をちゃんと実行して視聴者にお届けする素晴らしいですhikakin
0.938818276,好きなことで生きていく報告前は視聴者の心を昂らせ報告後は自分の夢を叶えることで視聴者を喜ばせるやっぱhikakinさんは本物のyoutuberだ
0.938767612,ヒカキンの熱意というか思いが分かるまず真っ先に自分で思う通りにするヒカキンが凄くて羨ましい
0.938673854,ラーメンメシめちゃくちゃ美味しそうなので買って食べて見たいと思います夢を現実に叶えられて良かったですねおめでとうございます
0.938474298,東京に住んでいなくても食べることが出来る名義だけ貸してるとかでもない本気の一品絶対食べます
0.938474178,本当におめでとう夢を叶えられて本当に良かったね楽しみにしてます
0.938462973,おめでとうございますとても美味しそうでアメリカでも買えたら嬉しい大ヒット商品になって海外進出もできますように
0.938382268,食べましためっちゃ美味しかったですしかも当たりが出たヤッター゚゚
0.938339829,私もバイトしてた頃社会人になってからもお世話になってますカップ飯もあるの有難い贔屓します
0.938260674,何かヒカキンクラスが初の商品開発って凄いな普通もっと格下のインフルエンサーでも出してるのにそれだけ慎重に製作してたって事かなこれはさすがに食べてみたい
0.937945426,hikakinさんの真剣さがこっちにまで伝わってきて感動しました元スーパー店員で僕の人生の諦めない部分をhikakinさんが救ってくれましたありがとうございます
0.937877595,嬉しいそうに紹介してるhikakinさん見てるとこっちまで嬉しくなります発売日絶対買います
0.937827945,こんな美味しそうなのコンビニで買えちゃうのすごい早く食べたい
0.937722385,0人の人間がこうやって死ぬ気で頑張っているのを見てるともはや伝記に見えてくるこの方は本当に澄んだ晴れた心を持っていると思う
0.937693477,おめでとうございます海外にいるので今直ぐ食べれませんが帰国したら食べたいですどんな味か楽しみ
0.937467396,すごすぎる夢を叶えていくのすごいよo̤◦o̤発売されたら絶対食べる人気すぎてすぐ無くなりそうで怖い
0.937312782,おめでとうございますとても美味しそうなラーメンですね早く食べてみたいです
0.937289357,こうゆう有名人の商品ってぼったくり多いけどヒカキンさんはちゃんと商品として出すのは尊敬
0.937058985,長年の努力が色んなところで反映されてるところが本当にすごいと思う
0.937001586,めっちゃ美味しかったです息子も喜んで食べてましたありがとう
0.93697232,田舎はないかと思ったけど全国で嬉しい絶対買う
0.936968148,味噌ラーメンは普段あまり食べませんが流石に買わずにはいられません0日セブンに走ります
0.936828196,世の中の色んなものを見たり食べたりしてきた人がこれは良いと思って作ったものたち興味あるわ
0.936806977,東京の店舗だと地方民は食べに行くの大変だけどセブンだったら全国のみんなが気軽に食べられるし0時間いつでも買いに行けるからすごくありがたいですあー早く食べたい
0.936804891,ラーメンしかたべてなかったけどホントにおいしかった0円で他より高めだけどリピありと思いましたまた食べてくなる味明日はカップ飯たべるの楽しみです
0.936720312,これは招き猫キンがでるまで食べたいと思います自分もラーメン大好きなので
0.936451614,はじめてヒカキンさんのラーメンを買いに0店舗行きましたけどご飯の方がなくてラーメンを食べたらくやしいけどおいしかったです
0.936450005,本当に尊敬する自分もヒカキンさんみたいな素晴らしい人間になるために色んなこと一生懸命頑張りたいです
0.93637377,味噌の甘味を人工甘味料で出そうと思ったら大間違いですぞ
0.936340749,自分的にはラーメンの方がそのときに食べたかったからおいしかった長文すいません
0.936309814,ヒカキンのラーメンを食べれるのは嬉しすぎる泣
0.936259091,ヒカキンさん新しいラーメンを発売されるということでおめでとうござまいす発売を楽しみに過ごさせていただきます
0.936255991,ラーメンに対する想いだったり幼少期からの思い出の味噌ラーメンのことも知れて感動で涙が出ました絶対買います
0.936249673,視聴者が体感しやすい食品への事業展開してくれてほんと嬉しい
0.936157465,故郷のラーメン屋さんのくだりは涙出るね具材や調味料だけじゃない背景や思い出が何よりの美味しさに繋がる隠し味
0.93611598,みんなと苦しい気持ちとか頑張ろうという気持ちとかを共有したいっていうのが凄く伝わる商品ですね早速発売日に買って食べたいですそして夢を叶えられたこと本当におめでとうございます
0.936114073,ずっと夢を持ち続けるって事がすごい普通は一つの事で満足しちゃいそう
0.936006248,別にヒカキンさんファンではないけどこの人の努力凄いと思うあと普通にラーメンうまそう
0.9359712,尊敬でしかないめちゃくちゃ努力を感じるし普通にめっちゃ美味しそう私もラーメンものすごく好きなので嬉しすぎます絶対買いに行きますおめでとうございます
0.935961008,アレルギーの関係で小麦がたくさん食べれないのでメシ版が凄く嬉しい味噌大好きです絶対食べます
0.935882568,人生も時間もお金も一切ムダにしない生き方に惚れてしまいます心底ステキですっ
0.93582058,私もラーメン大好きなので絶対買いますおめでとうございますここまで努力できるのが本当に尊敬します
0.935700893,マジですげぇわ休んでも休まなくて準備して一刻でも早くみんなに知らせれるよう努力してるとことか本当に美味しそうなのが伝わってるくる
0.935700655,最近買って食べてみました味噌もしょっぱ過ぎず麺はソフト具もシャキシャキしてて文句なかったです一応言っておきます食ってみな飛ぶぞ長州力風失礼しました
0.935673714,まってまさかのみそめし美味しそうすぎるヒカキンのことだから本当にこだわって作ってくれてるはず絶対食べまーす
0.935648024,なんかhikakinさんはyoutuberで成功してるからとかそういう妬み全くない努力が実った人だなぁって見れる
0.93550539,hikakinさんの血のにじむような努力が伝わってきますわ
0.935297847,売り切れてました店員さんに聞いたら製造はもうないって言ってたので食べられないかも
0.935260594,ありがとう感動をラーメンをhikakinさんが創るラーメンやその他の料理はどのインスタントよりも美味しそう
0.935191453,今までの様挑戦を経てたどり着いたラーメン食べるの楽しみです
0.935166955,胸が熱くなりました泣きそうです泣いてるけど感動の涙おめでとう御座いますこれからもお身体にお気をつけてください
0.935028851,夢を叶えるためにyoutube活動で忙しい中でもこだわり抜いて商品開発をしてたというヒカキンさんの裏側を見てると本当に勇気を貰える
0.934973896,出来ることなら毎日食べたいくらい同じくラーメンが好きなので必ず買って食べます
0.934904158,ラーメンなら豚骨以外断固拒否の自分だけどなぜかこれは食べてみたいと思った
0.934898853,自分の夢を叶えられる人がいてその瞬間を沢山の人と共有出来るのはhikakinだからですねおめでとうございます自分のやりたい事を本当に達成出来るのを証明してくれた貴重な人です
0.934873283,hikakinさんは安心して一生推せる発売が楽しみ
0.934846699,突然国家転覆やぁりましょうとか言われてもヒカキンさんなら株上がりそう
0.934801102,焼肉とか寿司って金持ちになったら良い店ばっかり行くだろうけどラーメンだけはどの店もほとんど同価格帯だし金持ちになっても食べたいと思うものだよね
0.93447572,嬉しいよ嬉しい前年は抜かされたけどそれまでは新潟がラーメン支出額0位だったんだラーメン王国新潟の誇りだよ
0.934421301,ヒカキンさんホントにラーメン好きですね自分の好きなもので夢が叶えれるのすばらしいと思う
0.934395194,ラーメンとかだけじゃなくてhikakinプレミアムの最初の商品なの夢があって嬉しい
0.934206545,水筒にお湯いれて学校に持っていって食べようとしたやついたで
0.934174299,シンプルに凄い本当に頑張ったんだなって尊敬できますね
0.93413049,翌日にはもう売り切れってこの企画は大失敗だと思う
0.934081316,すっげって漏れた本当に尊敬できる人物です
0.93404156,hikakinの夢って俺らに想像できんよなどんな凄い事なんやろ本当に楽しみすぎる
0.933994591,お疲れさまですヒカ様の努力と笑顔が多くの人の心に自然と入って来るのがヒカ様おめでとう御座います喜んで買わせて頂き応援していきたいと思いますヒカ様の声が笑顔が私達の元気の素です本当にありがとう
0.933982015,僕の夢は記憶がある時に東京に行く事でしたヒカキンと共に夢を叶えられて嬉しいです
0.933967948,お休み頂いてありがとうございますって上の立場になったにも関わらずほんと謙虚だよね尊敬する
0.933871806,純粋で真面目な人だなぁと改めて感心させられました
0.933849037,自分の予想のお店出すんじゃないかなと思ってたちょっと異なってましたただ是非とも食べたいです
0.9338305,好きなことにほんと全力一生懸命な方観てて面白いし楽しい尊敬沖縄でも販売あるかな
0.933719635,息子達と食べましたスープめちゃくちゃうまい酒粕の香りがします息子は今まで食べたラーメンで一番うまいと言っていました
0.933694959,絶対にうまいそうに決まってる言うまでもないね
