Column1,Column2,列1
0.8978979,色んな人が先走った噂を流してて嫌だったけど0月0日が楽しみでも抗がん剤治療中で退院まだだから退院したらすぐ買いに行く,
0.89787084,hikakinが作ったラーメンってだけで埋もれないね,
0.89786714,あのラーメン作るのはいいんですけどちゃんと休んでくれませんか応援してます早くラーメン食べたいです,
0.89786184,本当にどこまで人を笑顔にすれば気が済むんだかヒカキンさんは,
0.89783,おめでとうございます楽しみー早く買いたいみんなを勇気づけ幸せにできるラーメンヒカキンさんの想いが詰まってて素敵です,
0.8976775,息子と一緒に食べたいと思います,
0.89760244,hikakinさん忙しい中でも本当に好きなことして生きてる感じがしてすごくいい,
0.89742523,これはこれは努力の結晶でしかないですねぜひ見かけた際は食べて見ます,
0.89741427,hikakinさんは神なんなら仏の域にまで達してるただ普通に頑張っただけじゃあんまり夢って叶えられる物じゃないと思うからhikakinさんはものすごい努力の上にこの夢を実現してるんだと思う,
0.89725673,もう涙が止まりませんヒカキンさんの一生懸命努力出来るところとか本当に尊敬します絶対に買います,
0.8972034,ヒカキンが嬉しそうなの観てるとこっちも嬉しくなるね,
0.8970457,再生回数見て思ったけど今でもみんなの関心を惹き付けてる事が凄いちゃんとみんなhikakinの事気になってるんだね,
0.89700997,ラーメンとかだけじゃなくてhikakinプレミアムの最初の商品なの夢があって嬉しい,
0.8966963,体質がらラーメン小麦粉が食べられませんがメシも出してくれたなんて心から応援いたします,
0.8965996,ラーメンメシめちゃくちゃ美味しそうなので買って食べて見たいと思います夢を現実に叶えられて良かったですねおめでとうございます,
0.89645755,いつでも好きな事に全力なヒカキンさんやっぱり好きだなぁ,
0.8963486,ラーメンに凄くこだわって作られたのが伝わってきます発売日楽しみです,
0.89634824,セブンイレブンに0月0日に出るんですか買って食べて見ますね東京にラーメンやさんでやるかと思いましたヒカキンさん人気あるからめちゃくちゃ混むよねセブンイレブンに出るんだら良かったです,
0.8962972,ヒカキンさんのこだわりや夢思い出が詰まったラーメン頂きたいと思います本当におめでとうございます,
0.8959864,好きなことを極められる人は本当に努力をしてきた人だと思います尊敬,
0.8959623,味噌ラーメン味のカップ飯は売ってないからめちゃくちゃ嬉しいです絶対買います,
0.89593714,東京にラーメン店を開くとかじゃなくて手頃な価格で全国で買えるカップ麵にしたところがヒカキンって感じして好き,
0.8957288,hikakinさんやっぱ凄いわ誰でも手に入れられるコンビニでの販売嬉しいです,
0.89534986,hikakinの凄い所はラーメンとカップ飯を両方しっかり食べてるところ,
0.89530647,こういう有名人が関わる商品って大体ちょっと口出すくらいで後は全部任せるって感じの印象だったけどヒカキンはめちゃくちゃ従事しててやっぱこの人違うなって思ったわ,
0.89520735,ラーメン大好きなhikakinさんが作ったラーメンとか絶対に美味いやんあと手軽に買えるとか最高買うしかないわ,
0.895061,hikakinさんが嬉しそうに楽しそうにしてて元気でるなーアレルギークリアしてたら買って食べます無理だったら誰かにプレゼントします,
0.8950076,やはりラーメンは僕たちにとって最高なものですよね,
0.8950034,試食してる姿やパッケージのこだわりを語る姿がもはや有名店の凄腕ご主人感があってかっけぇ,
0.8949802,おめでとうございます0年間も私達の事も考え食べやすく美味しそうなラーメンを作って頂きこちらも凄く嬉しいです0月0日が凄く待ちどうしいです̖́,
0.89474446,何かとドキドキするけどヒカキンさんの夢が叶うんだったら嬉しい,
0.8946543,カップ飯大好きなので凄く楽しみです発売日にセブン直行します,
0.8945854,本当に幸せそうな人を見るのってこっちまで幸せな気持ちになるからいいよなぁ,
0.89454204,自分の好きな商品を自分で監修して商品として販売できるなんてすごいな,
0.89443827,本当に楽しみにしてますカートンで買いたいです,
0.89434487,ラーメン苦手だけどその中で0番好きな味がミソだから嬉しい絶対食べる〜,
0.89421475,若い頃に死ぬ程努力して今夢を叶えたり今の成果があるそう思うとやっぱりhikakinさんには憧れる僕もサボってばかりいないでひと踏ん張りしてみようかな,
0.8940917,開発チームに作ってもらってよく自分のラーメンだって豪語できるね,
0.8939323,ヒカキンが青色の服着てると嬉しい,
0.8939048,こうゆう有名人の商品ってぼったくり多いけどヒカキンさんはちゃんと商品として出すのは尊敬,
0.8938978,hikakinさんこんどでいいので薬品のシャンプーとリンスとボディーソープを作ってくださいよお願いします,
0.89389354,僕らに出来る最大の応援は買って美味しく食べるこれに尽きると思ってます絶対食べます,
0.89385027,全国で販売してくれるのめっちゃ嬉しいし絶対食べたい,
0.8938107,終始テンションが高くてどれだけ嬉しいのか分かる,
0.89365554,夢を叶えておめでとうございます本当にhikakinさんは凄い人,
0.89361084,商品紹介を主にやってたyoutuberがこうして今自分の商品を紹介してるのほんと感慨深い,
0.89361084,商品紹介を主にやってたyoutuberがこうして今自分の商品を紹介してるのほんと感慨深い,
0.89351285,自身のメンタルの支えになってたラーメンに対してyoutubeで結果を出して恩返しするのカッコ良すぎて,
0.89351106,ほとんどコメ0個はみんなついてるhikakinさんもっと休んでも良いですよ体調お大事に,
0.8934612,自分の予想のお店出すんじゃないかなと思ってたちょっと異なってましたただ是非とも食べたいです,
0.89344364,コンビニで買えるのが嬉しいです夢を叶えるってすごいです,
0.8933729,グッズじゃなくて自分自身のラーメンを出すなんて凄いです,
0.89329326,やっぱり好きなものを突き詰めるって大変だしやっぱり飽きもあるけど大事だよなマジでhikakinを見るとほんとに頑張ろうって気になれるわガチで元気もらえる,
0.8932647,0時間で0万再生超とはどれだけヒカ様の復活を心待ちにしてる人が多いか分かる,
0.89309365,ラーメンばばあのときを思い出す本当にラーメンが好きというのが伝わります,
0.89297515,こんなに楽しみな発表なかなかないから嬉しい絶対食べますこの勢いでラーメン屋さんも作ってください,
0.892704,hikakinさんにほんとに元気貰ってますし尊敬してます00❛ᴗ❛00ヶ月入院してて大変ですが退院したら絶対食べますψч☆,
0.89238334,誰でも手に取れる価格帯ってのもありがたい必ず買って食べますそしてみんなのコンビニ紹介気になりますね,
0.8923825,同い年で一番尊敬と安心感がある人柄ですラーメン発売おめでとうございます当日買いに行きます,
0.8922262,ニンニク味噌ラーメンって妙高のラーメンから来てるかなだとしたら新潟県民として凄く嬉しい,
0.89216226,hikakinの商品だから買わなくても安心と信頼があるのやばい,
0.8921496,内容ちゃんと見る前はラーメンとカップめしならラーメンがいいかなって思ってたけどこのカップめしめちゃくちゃ美味しそうやな発売日に買いに行こう笑,
0.8920553,hikakinさんのお陰で夢って叶うんだなーって本気で思った何かが好きなだけでこんなに頑張れるんだねまじで勇気というか希望というか貰った気がするやっぱりyoutuberの中で0番尊敬してるし0番大好きだなー•ᴗ•,
0.8918929,g明けに発売してくれるから連休明けのショックを和らげてくれているね,
0.89181775,おめでとうございますとても美味しそうでアメリカでも買えたら嬉しい大ヒット商品になって海外進出もできますように,
0.8917786,味噌ラーメンあまり好きじゃないが見かけたら0食食べてみます,
0.8917411,夢を実現させることが出来るのは努力し続けたからなんよなぁマジで尊敬する,
0.89161086,うわあすごく感動してなんかうるうるしましたこんなに頑張ってる人がいるから私も頑張らなきゃなって思います,
0.89150035,夢を叶えるって素晴らしいなーなんかヒカキンさん見てると明るい気持ちになる,
0.8913932,すごい興味あるラーメン0年間とは凄いですねでもほんとに何もしない期間を作って欲しいです,
0.8913447,いつもはhikakin面白いなぁ〜って感じで見てたけど今回のhikakinはカッコイイやっぱり夢を実現できる人はカッコイイです,
0.8912951,疲れてるからとかじゃなくて報告準備に集中するために休むといういつも視聴者思いのヒカキンさんならどんな報告でも応援できます,
0.89124227,お疲れさまですヒカ様の努力と笑顔が多くの人々の心に自然と入って来るのがヒカ様おめでとう御座います喜んで買わせて頂き応援していきたいと思いますヒカ様の声が笑顔が私達の元気の素です本当にありがとう,
0.89117795,夢を叶えるって本当にすごいことだよね自分がずっとやりたかったことをできたヒカキンを心から尊敬するわ,
0.89116335,何事にも本気でどんな時も頑張ってきたからできたことだと思う本当に心から尊敬します,
0.89106816,ヒカキンの熱意というか思いが分かるまず真っ先に自分で思う通りにするヒカキンが凄くて羨ましい,
0.8909471,夢を見るのは簡単だけど夢を叶えるのは難しいでもそれを叶えたhikakinさんは凄すぎる,
0.89077,カッコよすぎる絶対に買います味噌ラーメン好きなので早く食べたいです,
0.89074606,ヒカキンさんって本当にいい人だなぁ,
0.8906909,これは素直に食べたいそう思える熱量でした,
0.8906847,ヒカキンさんの努力は本当にすごいこれからも頑張ってください,
0.89051616,買いに行くね美味しそうもし叶うならヒカキンさんが着ているtシャツプレゼントキャンペーンしてくれますか,
0.8903878,hikakinさん醤油味も作ってくださいお願いします,
0.8903667,このラーメン食べるために一日頑張れる日が自分にもあるんだろうなと思うと嬉しいどうにか生きてる自分でもギリカップ麺に出せる値段で嬉しい,
0.8903591,夢はいくらでもあるけどそれを叶えれたっていうのが本当に凄いことだと心から思う,
0.8903527,マジですげぇわ休んでも休まなくて準備して一刻でも早くみんなに知らせれるよう努力してるとことか本当に美味しそうなのが伝わってるくる,
0.88999116,単純に小麦アレルギーで麺が食べられないからカップ飯あるの嬉しい,
0.88987815,他のラーメンより美味いとかそういう言葉使わないのがやっぱりhikakinって感じがして大好き,
0.8898553,こんなに成功してもちゃんと辿ってきたことを忘れてないところがとても好きです,
0.8897936,このラーメン好きアピールがしたいから何ヵ月前からラーメン旅とか始めたのかな,
0.8897351,ラーメンはもちろん食べますtシャツも買いたかったのにサイズがもう残ってないみたいです,
0.8897334,こうやってがんばってるヒカキン見てると自分も諦めないでがんばるぞって思う,
0.88965684,youtube活動だけでも忙しいのに他の夢も叶える事が出来るヒカキンさん凄いです,
0.8896137,絶対買うこんなの買わないわけ無いじゃないですかまずヒカキンさんの作ったラーメンってとこで買わないわけ無い,
0.8895523,嬉しいよ嬉しい前年は抜かされたけどそれまでは新潟がラーメン支出額0位だったんだラーメン王国新潟の誇りだよ,
0.88954866,いやー他のユーチューバーと違って金持ちしか手が出せない高い洋服とか出すよりこーやって誰もが買えて一回は食べてみたいと思うラーメンとか出すの良いね,
0.8894992,好きな事を趣味として生きていくの本当に尊敬してる,
0.889289,なんかヒカキンさんって自分の節目とかにいつも誰かの為にやる事ばかりでyoutubeを始めた頃から芯とか根本が全く変わらないんだろうなと泣きたくなる,
0.88918114,みんな恋人作ればリア充とか金持ちが自由とか言ってるけどヒカキンみたいな好きなことを本当に頑張れて嬉しさに溢れてる人が真のリア充だと思う,
0.88902974,醤油ラーメンも作ってくれませんか作ってもらえたらうれしくていっぱい買います,
0.888974,個人的に何より嬉しいのはヒカクラ0が再開することなんです,
0.8889306,そんなにらこだわったのに期間限定なんでしょもうお店出しなよそうしないと食べる人の本当の笑顔は見れないよ,
0.8889285,普通に美味しそうだし一般市民に気軽に手に入りやすくて凄くありがたいです買いますね,
0.8888764,0年前からbgmも変わってない純粋にビロガーで商品紹介をしてたヒカキンと何も変わってない最高なyoutuberだわ,
0.8886807,夢を叶えられるって凄い事だな自分の好きな食べ物を商品として出せるなんて凄い,
0.8886017,本当に今までずっとみていたのできっとhikakinさんならみんなをワクワクさせるご報告なのかな,
0.88820106,最近のヒカキンあるあるかもしれないけど後付けの夢っぽくてなんかねって感じここまでやる熱量とかは尊敬してます,
0.88811374,絶対買います夢がかなって良かったですね僕までもうれしくなりました,
0.8880376,期間限定じゃないよね〇〇タンメンの様に永久に店頭に並ぶと良いね,
0.88803613,夢があってもなかなか叶えられないことが多い中それが叶うだけでも凄いですそれだけでも感動です本当に夢を叶えることが出来て良かったですねおめでとうございます,
0.8880265,これだけの成功を収めているのにまだ夢を追う姿勢が好きです,
0.88792425,自分のやりたいことにここまで真剣に向き合って努力してしっかり結果残すことってできるようで中々できないことだから本当に尊敬する,
0.8878865,食べるのが楽しみです娘にも食べさせてあげたいです,
0.8877531,ヒカキンさんが超こだわったラーメンはやく食べてみたいです楽しみすぎます,
0.8876275,hikakinさんの一生懸命作ったラーメン食べてみたい ́,
0.8876053,味噌ラーメン苦手なので醤油か塩も作って下さい,
0.88756084,好きなものを自分の商品にしちゃうっていう偉業ほんとにすごい0年かかったり活動休止になるのも頷ける,
0.8873896,お店に行かなきゃネットで会員にならなきゃとかではなくて普通にコンビニで帰るのが本当に素晴らしい何より本人が楽しんでるのが最高必ず買いに行きまーす発売日に行くつもりだけど買えるかなーすっごく楽しみですヒカキンおめでとう,
0.8873438,夢を叶えることも凄いけど夢が叶う方の瞬間を共にできることは一視聴者としてとても喜ばしいです,
0.8872089,小さい頃にhikakinのグラセフ実況見てたけど母がそんなアマチュア見てないでテレビでもみなさいとか言われてたけど今は明らかにアマチュアじゃないだろババァ,
0.88712406,下積み時代ほんとうにしんどそうなのにここまで頑張って夢叶えてて尊敬します,
0.88699037,0年振りくらいにhikakintv開いたけどオープニングが全く変わってなくてなんか安心したいつでも帰ってきていいっていう安心感ある,
0.88697594,どこかに行かないといけないとかじゃなくてどこでも手軽に買えるってのが神夢叶えれて良かったです,
0.8869359,本当にこの人youtubeで自分の夢全部叶えるんじゃないかなずっと応援するけども,
0.88691664,彼は好きなことを継続しているようだだからこそフォローしなければいけない,
0.8868294,本当にすごいひかきんは嫌味なところが全くなくてすごく好きです,
0.8867975,発売したら食べたいですねでもすぐに売りきれそう,
0.8867142,自分的にはラーメンの方がそのときに食べたかったからおいしかった長文すいません,
0.88664806,普通にいい話なんだけど恩師を紹介するかのようなテンションでラーメンについて語ってるのなかなかにシュールで笑った,
0.8863723,自分も夢に向かって突き進んでさらに実現させるような人になりたいな〜,
0.88621736,ほんとにうれしそうつたわってきます東京に行ったりせずセブンで買えるなんてヒカキンさん本当にありがとうございます,
0.886123,純粋で真面目な人だなぁと改めて感心させられました,
0.885982,映像で作ってる普通のラーメンが食べたい,
0.8858903,パッケージのデザインもセンスあって素敵ですね下積み時代も人生が変わるその日もラーメンと共に感動的です,
0.8858185,自分の商品作ってたの凄てか休みじゃないじゃんまぁ自分のしたいこと実現できることってやっぱすっごくカッコイイこれからも頑張って下さい応援してます,
0.8858152,俺やっぱ純粋で何事にも本気なヒカキン大好きだわ,
0.8854998,ヒカキンさんの人生って夢あって好きすぎる,
0.8854735,ラーメン店にするの飲食だからインスタントより異物混入系の事件が起こりやすくなるから絶対こっちの方がいいよね,
0.8853963,セブンイレブンのオーナーやってますおそらく特発で発注上限かかると思いますが上限いっぱい発注させてもらいます,
0.8853184,なんとなくヒカキンラーメン好きだな〜って思ってたけどまさか作ってみたいと思ってたとは食いて〜楽しみだな〜,
0.88510865,内容がなんであれ夢を叶えるってのは普通の人ではなかなか成し遂げれないことだからほんとに凄いと思う,
0.88510865,内容がなんであれ夢を叶えるってのは普通の人ではなかなか成し遂げれないことだからほんとに凄いと思う,
0.885107,実は広島市中区に私の父親のお姉さん夫婦が第0店舗寿々女すずめを広島市中区舟入へ開店してます良ければ食べに行って下さい,
0.88498783,ヒカキンさんおめでとうございますラーメンへの熱い想いが伝わってきました本当に美味しそうで今すぐ食べたいです追記沢山のグッドボタンや返信本当にありがとうございます,
0.88497204,hikakinpremium立ち上げおめでとうございますヒカキンさんの夢が叶ったこだわりのラーメン楽しみです,
0.88465035,しょうゆラーメンが美味しすぎて味噌ラーメン食べたことないのに凄く美味しそうこれは買いだな,
0.8846425,初期の頃から忘れられないものってめちゃくちゃいいよねぇ〜しかもそれが実現出来るなんてロマンあるわ〜本当におめでとうございます,
0.8845913,最近味噌ラーメンハマってるからマジで嬉しい,
0.8845788,故郷のラーメン屋さんのくだりは涙出るね具材や調味料だけじゃない背景や思い出が何よりの美味しさに繋がる隠し味,
0.8845588,あのラ王より高いのはびっくりだけど0円なら全然食べたい,
0.88447535,何かヒカキンクラスが初の商品開発って凄いな普通もっと格下のインフルエンサーでも出してるのにそれだけ慎重に製作してたって事かなこれはさすがに食べてみたい,
0.88431585,スーパーで働いてて商品売ってた側なのに自分がプロデュースして販売するの本当に感動する0日当日買いに行こ,
0.8841896,尊敬でしかないめちゃくちゃ努力を感じるし普通にめっちゃ美味しそう私もラーメンものすごく好きなので嬉しすぎます絶対買いに行きますおめでとうございます,
0.8841324,まってまさかのみそめし美味しそうすぎるヒカキンのことだから本当にこだわって作ってくれてるはず絶対食べまーーす,
0.8841059,夢を叶えることが出来るヒカキンさんを皆らいたい,
0.88401186,やっぱりhikakinは人間性もパーフェクトだし表の人間としてもパーフェクトだと思う,
0.8839305,自分の好きな物を形にしてこだわって作るのってすげ〜よ本当にかっこいいよ発売されたら買う食べたいもんいや〜尊敬,
0.8836969,小さい子はにんにくは刺激的に感じるかもとかそういう配慮ができるのがすごいと思う,
0.8835815,hikakinさんの血のにじむような努力が伝わってきますわ,
0.8833561,努力は報われるってこの人のことをさしてるってぐらい努力してるラーメンは言い方悪いがお金を出せば手に入るだけどヒカキンの努力はお金なんかでは買えないほんと凄いおめでとう,
0.8832556,自分の好きなことしたいとか好きなもん作りたいとかは誰でも思うしお金とかがあればできるでもここまでしっかり自分で考えて色々試してみて0年掛けて自分が作りたかったもんを実現出来るってのは大変なんてもんやない自分のすることに熱意持ってとことんやっとるからみんなから人気になったんやと思う誰がどう言おうと俺は尊敬するな,
0.8831287,一切妥協しないこの人の出すラーメンなら味も期待出来そうですね後は値段か,
0.8831163,これだけ影響力ある人は何を発売してもすぐ大好評になりそう,
0.8830972,元スーパー店員が好きな商品を作れるまで有名になったのが本当に凄い,
0.88305104,ヒカキンは本当に充実してるなぁそうに決まってる,
0.88304937,自分が叶えたい夢を叶えられて本当にすごいと思う自分も見習っていきますそしてどんな報告でも受け入れていきます,
0.88303316,まさかこれをやるためにずっと商品紹介をやってきたのか,
0.88293725,hikakinが生きてる時代に生まれてこれて良かった,
0.88293034,ちゃんと全国のラーメンを回るという伏線をはっていたと思うと鳥肌もんだわ,
0.88274264,味噌ラーメンからもやしメンマネギ赤い調味油って感じがくるり意識してそうで好き,
0.8826812,0番びっくりしたのがhikakin様の書道が想像以上に上手かったこと,
0.88265765,色々考えていることが好感持てるまだまだたくさん好奇心いっぱいワクワクしかない,
0.88248116,おそらくしばらくお目にかかれないと思うので世間が落ち着いたら食べます,
0.882457,こだわっていたのでしたらセブンイレブンさんでなくても,
0.8824528,hikakinさんの夢が叶って良かった絶対買って食べます,
0.8824239,夢に向かって進んで行く姿に感動しました,
0.8824215,どんな報告でも応援することに変わりはないんだけど全国ツアーだといいなぁー♪♪,
0.88239276,ずっと夢を持ち続けるって事がすごい普通は一つの事で満足しちゃいそう,
0.8823543,グッズ系じゃなくてラーメンメインなのが個人的に嬉しい,
0.8822373,ずっと商品紹介してとうとう自分の商品ができたんですねおめでとうございますセブンのオーナーなのでたくさん発注しますね,
0.88205767,絶対にどっちも買います休んだ理由がこんなことでよかったですこれからも頑張ってください大好きです,
