Column1,Column2,列1
0.88203716,hikakinの夢が叶うのならいくらでも休んでいいのよ,
0.88203186,youtubeのみでここまで来れるって本当にすごいことだと思う,
0.8819107,はよ食べたいおめでとうございます夢を叶えていく瞬間をこうやって見ることが出来て同じ時代生きれて幸せです刺激もらいました,
0.8816496,ヒカキンさん新しいラーメンを発売されるということでおめでとうござまいす発売を楽しみに過ごさせていただきます,
0.8815054,hikakinさんは安心して一生推せる発売が楽しみ,
0.88133276,こうやって夢叶えちゃうからhikakinはすごいよ,
0.8811948,僕の誕生日にヒカキンが精神的におかしくなりそうだったのほんと草,
0.88116723,勝手に期待しといていざ発表した時文句言うのは違うだろ素直におめでとうでいいでしょ,
0.88112825,まじで気になるどんな結果でも応援してます,
0.88089967,味噌ってのがいいですね食べてみます次あれば豚骨も期待してます,
0.8807197,完成おめでとうございます発売楽しみですラーメンは豚骨とかが人気が多いですがそこを味噌でくるところがたまらないしかもニンニクいり最高楽しみにしてますあちこちのセブン巡りしよ,
0.8806653,自分の夢のために活動をお休みは全然いいと思う自分の夢を誇りに思え,
0.8805417,今までと全く違うトーンのヒカキンさん感動しました,
0.8804974,夢を実現することはとても難しい事を叶えるってすごいと思いました0月0日コンビニで探します,
0.88046056,同年代でハモネプやってたって思うといつも鳥肌というか感慨深くなりますˇωˇ,
0.88043964,好きなことで生きているを体現したまさに偉人私たちに夢を与えてくれて本当にありがとう,
0.8804334,ほんとに努力の積み重ねが遂に実った感じが伝わります,
0.880381,ヒカキンさん0年前ゲーマーと言いましたよね,
0.8803617,私もバイトしてた頃社会人になってからもお世話になってますカップ飯もあるの有難い贔屓します,
0.88030267,ラーメンの無い世界なんて考えられないほんとにラーメンって多くの人を救ってると思う,
0.88029456,向上心あって素晴らしいラーメン旅もしてるくらいだから好きなんやね,
0.8802832,これからこちらの新商品のpop作りをさせていただきますセブンイレブン社員です売り切れそうわたしも食べます,
0.880216,売り切れたら終わりとかじゃ無くどんどん作っていつでも買えるようにしてね♪,
0.88017243,もしかしてこの味噌はヒカ菌から作られててすごい美味いのか,
0.8799521,いやすごすぎるわyoutube活動だけでも忙しすぎるのにその合間を縫って自分の夢を叶える活動をするなんて,
0.8798565,youtube続けながらもこれを着々と進めていたと考えると本当にすごい,
0.879582,店舗じゃないところがまたyoutubeの身近さを感じましたなんか泣きそうになったおめでとう,
0.8795755,夢をちゃんといつも叶えていくのがかっこいいおめでとうございます,
0.87948626,hikakinさんが幸せなことならこっちも嬉しい気分になれる,
0.87913173,hikakinさん花月嵐ラーメン屋に行ってくださいお願いします,
0.8790418,自分の夢を叶えれて良かったですね,
0.8790269,大好きなラーメン旅企画が商品開発の伏線だったの嬉しすぎ,
0.8790259,ぼくもラーメン大大大好きです夢が叶ってよかったー,
0.8790001,濃厚味噌で香味油白味噌使用麺処くるりが本当に好きだったんだなって分かるわな,
0.87888867,視聴者の意見どうこうじゃなくてちゃんと自分の好きなこと貫いて努力してるのかっこよすぎる,
0.87888044,夢を叶える人って裏で相当苦労してるのが垣間見える本当にすごい,
0.8788614,ヒカキンさん今年セイキンさんとの曲作らないんですか,
0.87885535,濃厚味噌ラーメンと濃厚味噌メシどれも美味しそう買う時間があったら両方買います,
0.8787789,濃厚味噌ラーメンが税込で0円なのなぜかひかきんの優しさ詰まってるような感じがしてすき,
0.87856317,当たりがでたらもう一個もらえるという機能はどうですか,
0.8785064,誕生日の日に販売開始してくれてありがとうございます誕プレとして買ってもらいます,
0.87848145,作ってるというか味見して文句言って作らせてるだけよねこういうの作るってのは自分でダシとって作って初めて持ってってそれを再現させるのがいいのに名ばかりラーメンでわなぁ購買意欲にはつながりませんぬ,
0.8784423,hikakin様がラーメン食べてた所の店長びっくりするやろなぁ,
0.8783696,しょうもないとか言ってる奴ら人の夢を0文字で片付けるなよhikakin本当におめでとうこれからも一生ついていくわ,
0.87835956,夢を叶えるってなかなかできないことそれをこんなんでとか言ってる奴なんか気にすんなというか本人は全然気にしてないと思うけど,
0.87829137,熱湯入れたら0分じゃなくて0分待つのかさすがヒカキン全てがオリジナル,
0.8782561,もうすまんけどhikakinさん超えるyoutuberはほんとにいないもう俺が決めたこの人は人としてもyoutuberとしても最高って感じで大好き,
0.87795943,ジジキンは天国で笑ってるヒカキンのゆめが叶ったから,
0.8779327,自分の夢を叶えるために0年間頑張ってそしてその準備のためにたった一週間視聴者を待たせないようにすることができるyoutuberの鑑,
0.8779195,ヒカキンのことだから妥協せず真っ当に頑張ってこだわって制作したんやろな,
0.877855,味噌ラーメン好きなので見かけたら絶対買います,
0.877793,休むじゃなくてシンプルにすごいことしてる本気度がすごく伝わる,
0.877785,偏見だけどさこういう体型の人が作ったものって美味くない,
0.8777377,ポジティブな報告なのかネガティブな報告なのか事前に言ってくれるのを本当のありがたい心持ちが穏やかで見られる,
0.8777196,自分の夢を追うという事は凄く良い事とだと思う,
0.8775923,急上昇0位おめでとうございます0年かけてできたラーメンが買える日が待ち遠しいです,
0.87737894,時代に残るものを明確に作れるってのは誰にでも出来ることじゃないよすげえなあ,
0.87735915,本当の予想外すぎて困惑しながら普通に嬉しい俺がいる,
0.8773416,味噌ラーメンは普段あまり食べませんが流石に買わずにはいられません0日セブンに走ります,
0.87733376,すごすぎる夢を叶えていくのすごいよo̴̶̷̤◦o̴̶̷̤発売されたら絶対食べる人気すぎてすぐ無くなりそうで怖い,
0.87732536,ヒカキンこそ努力に努力を重ねたtheyoutuberって感じまじですげぇ,
0.87716126,0月0日になったらすぐセブン行って買ってきすラーメン好きだしめっちゃ楽しみ,
0.87710637,ラーメン作るためにダーツの旅やってたとしてもあれは辞めないで続けて欲しい,
0.8770904,ぼくの将来の夢はyoutuberとラーメンを作ることですまさかの同じ,
0.87691665,こんな休みのない多忙の中でラーメンの商品作りも進めてたの凄すぎでしょ絶対食べます,
0.87689245,小麦アレルギーだからご飯あるの嬉しいお母さんにラーメン食べてもらおうヒカチャンよかったね,
0.87685406,わぁー夜中に再生してラーメンクッソ食べたくなったー発売したら買います0月0日楽しみ,
0.8768124,ラーメンに目をつけるとはセンスというかなにもかもスゴすぎてさすが神と呼ばれるだけある全youtuberびっくりしてんだろうなぁ,
0.8767348,〇〇監修って名前だけ貸して開発とかはほぼ任せっきりな人もいる中こんな0から0まで全部本気で本人が携わってるのすごいな,
0.8767133,東京に住んでいなくても食べることが出来る名義だけ貸してるとかでもない本気の一品絶対食べます,
0.8766561,また新しい夢の実現を期待してます頑張ってください,
0.8766274,休止理由もヒカキンらしくて応援したくなるなぁ,
0.87660235,このままいけばヒカキンさんも0日で0万再生いけるぞ,
0.87658864,この人のこだわりましたほど説得力のあるものは無いよねめちゃくちゃ楽しみ,
0.87655985,めちゃくちゃこだわり抜いて作られたのがすごく伝わりました絶対買います,
0.8764513,この人ほんといつでも自分の夢に向かっててかっこいい,
0.87644595,頂点がこの人で良かったと何度思えばいいんだろうか,
0.8763557,このコメント残念だわまずそうとか言ってる奴は絶対買うなよヒカキンさんの努力の何も知らない奴が語ってんじゃねーよ,
0.8763332,おめでとうございます全然関係ないけどサービス終了が決まったアプリゲームをサ終取り消させてみたみたいなの出来たら見てみたいですガンダムブレイカーモバイルとか,
0.87610567,まじでかっこいいどんなに苦しくても辛くても頑張った先にこんな未来が来ると信じてがんばります,
0.8760566,0年間大好きなものに熱中して本気でできるの本当に尊敬,
0.8760375,本当に心からおめでとうと伝えたいヒカキンはほんと凄い,
0.87599516,そういう事だったんですね夢を持って努力して叶えるなんて凄いです本当におめでとうございますこれからも応援してます,
0.8758177,これは売り切れなるだろうなー買いたい名言食べ終わったら容器は綺麗に保存だほんと美味しそうで,
0.8756996,ヒカキンが食べてるものなんでも美味しそうに見えるのなんでだろう,
0.87536466,待ってましたヒカキンさんの夢の報告楽しみです,
0.8753243,ラーメン好きだから嬉しいあと落ち着いたらちょっと休んでほしい切実,
0.87521815,これがヒカキンがの視聴者側へのドッキリだとしたらマジで笑える,
0.8751867,すごく食べてみたくなりました見かけたら絶対に買って食べます,
0.8750462,hikakinってたまに見るとほのぼのしてふふってなれるなんか疲れてたけど少し心穏やかになれたhikakinありがとう,
0.8750248,品切れしまくってる未来が容易に想像できる笑,
0.8749341,すぐ完売しちゃいそういつ食べれるかわからないけどめっちゃ楽しみです,
0.87481654,やりたいことをなんでもできちゃうそれがヒカキンの力短いお休みで休めたかなもうちょっと休みたいよね,
0.8746961,こんな素敵な人本当に居ないしもうほんと大好き頑張ってほしい,
0.8746616,僕もラーメン食べて0万人にザーメンかけます,
0.87454444,ラーメン食べてみたいニッシンとすごいね元スーパー定員とは思えないよね,
0.8745374,勝手に報告だとばかり思ってたから予想外すぎたけどヒカキンさんのyoutuberとしての夢とは別の夢が叶って本当に嬉しい,
0.87448865,絶対買いますhikakinさん素敵です休んでないですよそれみんなのために頑張ってるとか尊敬です,
0.8744076,すげぇよヒカキンさんそしておめでとうこれからも応援しています,
0.87431794,後半情熱大陸のような感動が発売心待ちにいています,
0.87427235,本当にこの人は努力が凄いな,
0.87407476,本当に努力してきたのが伝わりましたラーメン絶対買う,
0.8740565,なんかhikakinさんはyoutuberで成功してるからとかそういう妬み全くない努力が実った人だなぁって見れる,
0.87402344,しょうもないって言われても夢を叶えられることはすげーよ,
0.87396276,どうせhikakin印のラーメンでも作ったんでしょ鼻ホジ,
0.87387764,ラーメンとカップめしはくどくないんですか,
0.87384784,この人はたった一週間の休みのために盛大にみんなのことを考えてるんだなこの人こそ本物の聖人だ,
0.873781,しょうもなって言ってる奴お前らが高く見すぎただけやろ本当にhikakinさんおめでとう,
0.8736179,らーめんもいいがもうそれ以上太るではないぞ,
0.8735566,多分都会の方でしか流通してないと思うセブンイレブン行ったけどなかった,
0.8735426,復帰は0日か0日って言ってたけど早い方にしてくれたのはありがたすぎますご報告楽しみです追記報告見ました発売日gじゃないのと平日ってのがまたいいですね欲しすぎる,
0.87354136,夢の実現おめでとうございます伝えたいことが箇条書きなのがわかりやすく誠実でラーメン屋っぽくもある,
0.87350976,ただ休んでただけじゃなくて頑張ってラーメン作ってたのは感動,
0.87345433,努力が報われる瞬間はまさにこの事なんだろうなヒカキンさんおめでとうございます,
0.8734298,お金を考えないで自分がしたいことできるのは努力の賜物だな,
0.87341076,hikakinさんおめでとうラーメン絶対買うわ,
0.8733248,感動するなぁヒカキンさんの夢が叶ったの本当に嬉しいなおめでとうございます,
0.8732973,どんな小さな事でも夢を叶えられるって素敵な事だよね,
0.8732882,他のyoutuberがやるぼったくりアパレルとかじゃなくて本当に自分がやりたいことを実現できるのは尊敬ですo゚▽゚o,
0.8732151,ラーメン大好きだから必ず食べます,
0.873053,夢を叶えられた事おめでとうございます素晴らしい発売したら絶対買いに行っちゃいますスバラシイ,
0.87303907,ヒカキン俺このラーメン買うよサイコーじゃんyoutubeドリーム見せてきた男の夢の結晶でしょ,
0.87302846,くるりと蒙古タンメンに謝った方がいいよ,
0.872929,数百年後とかhikakinの人生大河ドラマになってもいいと思う,
0.87289566,夢を持つこと自体は誰にだってできるけどそれを叶えることはそれだけの努力をした人しか出来ないほんとに凄い,
0.8728954,一時期すごい太ってた時あったけどラーメンの味作ってたのか,
0.8728308,0年間かけたラーメン絶対買いに行きます楽しみです,
0.8728014,マジで気になって夜しか寝れなかったから楽しみだわ,
0.8727863,コンビニで買えるのはいいですね,
0.87278295,夢を実現させるのは困難でもヒカキンは努力でその困難の壁をぶち破ったほんと凄い,
0.87270445,これだけ成功してても夢に向かって走り続けて実現させるとかカッコ良すぎる一人の人間として尊敬,
0.87256914,わかりみが強いですラーメンは人生です必ず買います,
0.8725155,えスゴすぎるほんとに尊敬しますこれからも頑張ってくださいでも体調には気おつけてください何時でも応援してます,
0.87242025,初コメどのyoutuberが食レポしてくれるんだろう忖度なしで私的にはサッポロ0番味噌ラーメンを越えるかどうか,
0.87241346,泣きそうになるくらい相変わらず感動しました,
0.8723142,お前が実際ラーメン作って客に対して永遠と対応するなら応援する裏切るなよ,
0.87226546,なんか泣けてきたよヒカキンさんあなたはほんとにyoutube界の宝だよ,
0.8722431,おめでとうございます絶対に買って食べたいと思います本当に美味しそう急上昇ランキング0位素晴らしいです,
0.87222093,発売日が0月0日ってさドラゴンボール好きなことも込めて悟空なのかなって思ったけど偶然だよなぁ ́ω,
0.8721816,セイキンさんおすすめシールを貼って発売してほしい,
0.87215096,こんなに有名になってもまだまだ夢に向かって努力するヒカキン素敵すぎる,
0.8721135,半年後とかにスプラトゥーンのフェスで味噌ラーメン派対味噌メシ派の戦いあると思ってだけど今のスプラトゥーンフェスの選択肢三択なの萎える,
0.872094,おめでとうございます私もラーメン大好きなので楽しみ過ぎます,
0.8720707,特別hikakinがすきってわけじゃないわたしでもめちゃくちゃ凄いなって思うしやりたいこと叶えてること尊敬するしもうなんか凄いなって思います語彙,
0.87199795,なんかhikakinが幸せそうで私もうれしい,
0.87199634,何事かと思ったらラーメンで草0円も出すならすみれでええわ,
0.87190795,自分のやりたいことを全力で出来るのカッコよすぎる,
0.8718437,youtubeやりながら0年これを作れたのはすごいと思う,
0.8718131,やっぱhikakinさんは努力のが凄い,
0.8718091,本当におめでとう夢を叶えられて本当に良かったね楽しみにしてます,
0.871809,夢を叶えるためにyoutube活動で忙しい中でもこだわり抜いて商品開発をしてたというヒカキンさんの裏側を見てると本当に勇気を貰える,
0.8717573,めっちゃ素敵ですね♪ラーメン食べますねナイスゥyoutuberが飲食に手を出す流れが出来てますね焼肉カレーパンラーメンありがとうございます♪あと唐揚げも食べてみたーい,
0.87174636,夢が叶って私も嬉しいです,
0.8717146,同じ新潟県民として全力で応援し続けます頑張れhikakin,
0.8716176,店をひらくなら遠すぎてヤバい青森だからだけどコンビニなのがいいしお手頃価格なのがいい,
0.87150574,みそキン必ず買いに行きます行く時間であればいいけど,
0.8714813,ちっちゃい頃からラーメン好きなんすよね,
0.8713948,初めどれだけすごいか分からんかったけど冷静になって考えたらとんでも無いことしてるの草,
0.871391,明日から発売ですけどちゃんと手に入るかなーすぐ売り切れてたりして,
0.8713844,こだわってる理由がもし上辺だけだったとしてもやさしすぎる,
0.8711545,一年賭けたラーメン食べますね〜近くで買えるの嬉しい,
0.8711099,これ辛いの麻婆豆腐しか食ったことのない中学生でもくえますか,
0.87103796,お金持ち始める献呈的な人調子にのりすぎだわでも売れるといいですね,
0.87102354,これが自分の誕生日に発表されて嬉しい,
0.8708132,こっちまで嬉しくなるわぁ絶対買うてかセブンで売ってるのすご,
0.870791,ヒカキンが笑ってるとこっちまで幸せになる,
0.8705764,元スーパー店員の経験とか活かして商品開発してるのすごいそのままスーパー続けててもその内商品開発部とかに異動してたかもしれないね,
0.8705261,発売決定おめでとうございます0月0の発売日に0つとも買いますこれからも応援してます頑張ってください,
0.87038225,だからラーメンダーツとかやってたんだね好きなものを本気にできるのって本当に尊敬できる,
0.8703669,発表するまで0分もかからないの流石ヒカキンって感じして好き,
0.87027115,好きなことに本気になれるの本当に尊敬するわ,
0.8700576,00ここで無駄に謙遜しないで0億点を自分に送るのすごく好き,
0.8699398,いい歳したおっさんがこれレジ持ってきたら笑うわ,
0.8697755,ヒカキンさんのことやからしおきんつけきんすでに準備しとると思います,
0.86974025,hikakinさん大好き𓂃𓈒𓏸𓂃𓈒𓏸𓂃ラーメン美味しそうですね,
0.86972064,こってり好きにはたまらん楽しみに待ってますラーメン大好きだぁ,
0.86962616,現在イギリスに住んでいますが両親に頼んで送って貰います改めておめでとうございます,
0.8695703,マジで努力してるのが感じられる尊敬やわ,
0.8695703,マジで努力してるのが感じられる尊敬やわ,
0.86956644,プレミア公開の時コメントで文句奴多すぎて悲しくなったわ素直に祝ってやればええやんけ,
0.86953336,ヒカキンは何回ラーメンと言ったでしょう,
0.86929417,くそー食べたいのに近くにセブンがないあったとしても二時間かかる,
0.86915183,映像ヒカキンが作ってるの何気に凄い00,
0.869141,味噌をこだわるとか具体的なコンセプトがないゆえどんなものを作りたいのかよくわからなかった,
0.86902094,活動の休み時間が夢を追い続けていた時間とかカッコよスギル,
0.8688413,いやもうほんっと幸せそうすぎてこっちまで幸せになりましたラーメン大好きなのでどちらもぜっったい食べます楽しみ,
0.8687204,hikakinの夢が叶って本当に良かった,
0.8687117,しょうもなってコメントちょくちょくあるけどこれのどこがしょうもないのか説明して欲しい笑笑,
0.8686476,おめでとうございますとても美味しそうなラーメンですね早く食べてみたいです,
0.86862,絶対買いに行きます楽しみにしています,
0.8683908,好きなことにほんと全力一生懸命な方観てて面白いし楽しい尊敬沖縄でも販売あるかな,
0.86826384,そうだったのか僕もうれしいしヒカキンさんもうれしいのか,
0.8682398,お休み頂いてありがとうございますって上の立場になったにも関わらずほんと謙虚だよね尊敬する,
0.8681178,取り敢えず二種類買うヒカキン応援してるから,
0.86801535,本当に向上心が止まらないなこの人は,
0.86792,発売楽しみにしてます ́出来たら違う味もお願いしますmm,
0.86791074,ファミマ派だからファミマまで置いて欲しかった感ある,
0.8678774,夢を叶えるその力凄すぎです尊敬,
0.8678598,本当に凄い努力の賜物ですね,
0.86777407,絶対買いますでも売り切れてそうで怖い,
0.86757433,自分のやりたいことをずっと貫いてんのすごすぎるこれが本物のyoutuberか,
0.86743414,食べたかったけどたまごアレルギーだつらいたまごなしのもだしてヒカキン,
0.86739206,これは売れる口角が上がる感覚わかりますさっそく0日からセブン見てきます,
0.8672874,麺の硬さが気になって,
0.86691284,シンプルになんか感動した笑やっぱヒカキンってすごいな,
0.8668862,0万なんて売上だけですぐ回収できるのよhikakinはだから大したことない,
0.8667335,スーパー兄弟地元の人も嬉しいし誉ほまれだよね,
0.86671543,で一週間休んで何をしていたん笑要は期待商法やんな一週間身を隠して遊んで期待値を上げたかったん,
0.8666808,めちゃくちゃ美味しそうに食べるからお腹すいてきました絶対どっちも買います,
0.8666447,服とかじゃなくてラーメンってのがhikakinらしくて好き,
0.8666293,見てるだけで腹減ってくるわ,
0.86650985,これだけの熱量で作ったラーメン絶対おいしい,
0.86643946,ヒカキンさんかっこいいと思う人↓,
0.86639285,久々に見たらソファの人形がヒカキンだらけになってる,
0.8663707,ラーメン好きアピール多すぎて嫌味が差してくるけどめちゃくちゃうまそう,
0.8663274,ヒカキンのいつもの癖ならみそおって名付けそうなのに,
0.8663086,ラーメン美味しそうですけどめそらーめん食べれないのでしょうゆとかでもいいので食べたいです,
0.86622995,泣けましたおめでとうございます0日セブン出勤なので必ず買わせていただきます出勤前に売り切れちゃいそう楽しみです,
0.8660699,0日か0日にって言っていてしっかり0日にあげてくれるところが本当流石すぎる,
0.8659982,夢を叶えるために頑張ってきたことが本当に素晴らしいです,
0.8657855,お身体に気をつけてくださいね次はほんとに0ヶ月くらいお休み取ってくださっていいんですよー,
0.8655919,ラーメンを初めて作った人ラーメンを広めた人ラーメン屋の人みんなヒカキンさんを支えてヒカキンさんをこんな大物にまでさせてくれてありがとう,
0.8655692,0ヶ月でも休んでくれてよかったくらいすごいことしててほんと尊敬する,
0.86553395,サムネ明るいから良い内容だと信じたい,
